Link,Tiêu đề,Địa chỉ,Địa chỉ 1,Địa chỉ 2,Mức giá,Giá/m²,Số phòng ngủ,Huyện,Diện tích,Mặt tiền,Đường vào,Hướng nhà,Hướng ban công,Số tầng,Số toilet,Pháp lý,Ngày đăng,Ngày hết hạn,Loại tin,Mã tin,Latitude,Longitude
https://batdongsan.com.vn/ban-nha-rieng-duong-tay-ho-phuong-quang-an-2-6/ban-at-tang-ks-chu-can-ban-gap-toa-ks-640m-10-tang-chi-368-ty-pr45901140,"* Bán đất tặng KS, Chủ cần bán gấp tòa KS Tây Hồ 640m, 10 tầng, chỉ 368 tỷ.","đường Tây Hồ, Phường Quảng An, Quận Tây Hồ, Hà Nội | (Phường Tây Hồ, Hà Nội mới)","đường Tây Hồ, Phường Quảng An, Quận Tây Hồ, Hà Nội","(Phường Tây Hồ, Hà Nội mới)",368 tỷ,~575 triệu/m²,,Tây Hồ,640 m²,25 m,6 m,,,10 tầng,,Sổ đỏ/ Sổ hồng,12/06/2026,19/06/2026,Tin VIP Bạc,45901140,21.0650583650176,105.823680257855
https://batdongsan.com.vn/ban-nha-rieng-duong-thuy-phuong-phuong-dong-ngac-718/ban-can-ho-dich-vu-ket-hop-e-o-pr45901069,Bán căn hộ dịch vụ kết hợp để ở,"Đường Thụy Phương, Phường Đông Ngạc, Quận Bắc Từ Liêm, Hà Nội | (Phường Đông Ngạc, Hà Nội mới)","Đường Thụy Phương, Phường Đông Ngạc, Quận Bắc Từ Liêm, Hà Nội","(Phường Đông Ngạc, Hà Nội mới)","9,2 tỷ","~171,96 triệu/m²",,Bắc Từ Liêm,"53,5 m²",,,,,,,,12/06/2026,27/06/2026,Tin VIP Bạc,45901069,21.0923272684895,105.785091032832
https://batdongsan.com.vn/ban-nha-rieng-duong-nguyen-khanh-toan-phuong-nghia-do-1-7/lo-goc-ngo-thong-o-cho-thue-tuong-lai-1-ra-pho-gan-ho-qh-on-inh-45m2-pr45900950,"Lô góc Nguyễn Khánh Toàn, ngõ thông, ở/cho thuê, tương lai 1 nhà ra phố, gần hồ, QH ổn định, 45m2","Đường Nguyễn Khánh Toàn, Phường Nghĩa Đô, Quận Cầu Giấy, Hà Nội | (Phường Nghĩa Đô, Hà Nội mới)","Đường Nguyễn Khánh Toàn, Phường Nghĩa Đô, Quận Cầu Giấy, Hà Nội","(Phường Nghĩa Đô, Hà Nội mới)","8,2 tỷ","~182,22 triệu/m²",3 phòng,Cầu Giấy,45 m²,,,,,5 tầng,,Sổ đỏ/ Sổ hồng,12/06/2026,19/06/2026,Tin VIP Bạc,45900950,21.0369638223012,105.801797119246
https://batdongsan.com.vn/ban-nha-rieng-duong-hoang-quoc-viet-phuong-nghia-do-1-7/6-tang-thang-may-20m-ra-pho-quy-hoach-on-inh-pham-van-ong-vi-tri-ep-pr45900940,6 tầng thang máy - 20m ra phố - quy hoạch ổn định - Phạm Văn Đồng Hoàng Quốc Việt - vị trí đẹp,"Đường Hoàng Quốc Việt, Phường Nghĩa Đô, Quận Cầu Giấy, Hà Nội | (Phường Nghĩa Đô, Hà Nội mới)","Đường Hoàng Quốc Việt, Phường Nghĩa Đô, Quận Cầu Giấy, Hà Nội","(Phường Nghĩa Đô, Hà Nội mới)","11,3 tỷ","~305,4 triệu/m²",4 phòng,Cầu Giấy,37 m²,4 m,4 m,,,6 tầng,,Sổ đỏ/ Sổ hồng,12/06/2026,19/06/2026,Tin VIP Bạc,45900940,21.0462866363481,105.798954491228
https://batdongsan.com.vn/ban-dat-xa-chu-phan/3ty2-chenh-nhe-co-100m-at-au-gia-phan-pr45678062,3ty2 + chênh nhẹ có 100m đất đấu giá Chu Phan,"Xã Chu Phan, Huyện Mê Linh, Hà Nội | (Xã Yên Lãng, Hà Nội mới)","Xã Chu Phan, Huyện Mê Linh, Hà Nội","(Xã Yên Lãng, Hà Nội mới)","3,2 tỷ",~32 triệu/m²,,Mê Linh,100 m²,5 m,6 m,Bắc,,,,Sổ đỏ/ Sổ hồng,12/06/2026,19/06/2026,Tin VIP Bạc,45678062,21.1744977281494,105.652777523442
https://batdongsan.com.vn/ban-dat-xa-tan-xa/sieu-pham-77m2-trung-tam-view-ho-gia-2-1-ty-cach-dai-hoc-fpt-5ph-di-chuyen-pr44848630,"Siêu phẩm 77m² trung tâm xã Tân Xã view hồ giá 2,1 tỷ, cách Đại học FPT 5ph di chuyển","Xã Tân Xã, Huyện Thạch Thất, Hà Nội | (Xã Hạ Bằng, Hà Nội mới)","Xã Tân Xã, Huyện Thạch Thất, Hà Nội","(Xã Hạ Bằng, Hà Nội mới)","2,1 tỷ","~27,27 triệu/m²",,Thạch Thất,77 m²,,,,,,,,12/06/2026,22/06/2026,Tin VIP Bạc,44848630,21.0199870045906,105.545107979452
https://batdongsan.com.vn/ban-dat-xa-lien-ha-2/cuc-hiem-at-ep-o-to-tranh-phong-thu-lam-nhinh-4-ty-pr45900220,"Cực hiếm đất đẹp ô tô tránh siêu đẹp 52,7m2 Hà Phong, Thư Lâm, giá 3,95 tỷ","Xã Liên Hà, Huyện Đông Anh, Hà Nội | (Xã Đông Anh, Hà Nội mới)","Xã Liên Hà, Huyện Đông Anh, Hà Nội","(Xã Đông Anh, Hà Nội mới)","3,95 tỷ","~74,95 triệu/m²",,Đông Anh,"52,7 m²",,,,,,,Sổ đỏ,12/06/2026,22/06/2026,Tin VIP Bạc,45900220,21.1445385780666,105.897519143768
https://batdongsan.com.vn/ban-dat-xa-cam-linh-1/ban-ba-vi-gan-ho-suo-hai-duong-nhua-xe-tai-xe-buyt-do-so-do-dt-100m2-gia-f0-pr44112766,"Bán đất xã Cẩm Lĩnh, Ba Vì, gần hồ Suối Hai, đường nhựa, xe tải, xe buýt đỗ. Sổ đỏ DT 100m2, giá F0","Xã Cẩm Lĩnh, Huyện Ba Vì, Hà Nội | (Xã Suối Hai, Hà Nội mới)","Xã Cẩm Lĩnh, Huyện Ba Vì, Hà Nội","(Xã Suối Hai, Hà Nội mới)","7,9 triệu/m²",~790 triệu,,Ba Vì,100 m²,7 m,,,,,,Sổ đỏ/ Sổ hồng,12/06/2026,19/06/2026,Tin VIP Bạc,44112766,21.1703199922932,105.353246523371
https://batdongsan.com.vn/ban-nha-rieng-duong-lang-phuong-lang-ha-3/chinh-chu-ban-ngo-426-uong-ong-a-75m-co-thang-may-gia-28-ty-tl-bao-tron-thue-phi-pr45900025,"Chính chủ bán nhà ngõ 426 Đường Láng, Đống Đa 75m² có thang máy, Giá 28 tỷ TL - bao trọn thuế phí","Đường Láng, Phường Láng Hạ, Quận Đống Đa, Hà Nội | (Phường Đống Đa, Hà Nội mới)","Đường Láng, Phường Láng Hạ, Quận Đống Đa, Hà Nội","(Phường Đống Đa, Hà Nội mới)",28 tỷ,"~373,33 triệu/m²",6 phòng,Đống Đa,75 m²,,3 m,,,6 tầng,,Sổ đỏ/ Sổ hồng,12/06/2026,19/06/2026,Tin VIP Bạc,45900025,21.0116221927185,105.809985468633
https://batdongsan.com.vn/ban-dat-xa-tan-xa/ban-gap-152m2-manh-at-vang-mat-ho-noi-quy-tu-moi-nhan-tai-cua-at-nuoc-chi-25-ty-bao-so-o-pr45895853,Bán gấp 151m2 mảnh đất vàng mặt hồ Tân Xã nơi quy tụ mọi nhân tài của đất nước chỉ 25 tỷ bao sổ đỏ,"Xã Tân Xã, Huyện Thạch Thất, Hà Nội | (Xã Hòa Lạc, Hà Nội mới)","Xã Tân Xã, Huyện Thạch Thất, Hà Nội","(Xã Hòa Lạc, Hà Nội mới)",25 tỷ,"~165,56 triệu/m²",,Thạch Thất,151 m²,,30 m,,,,,Sổ đỏ/ Sổ hồng,11/06/2026,18/06/2026,Tin VIP Kim Cương,45895853,21.0194789854341,105.545056806069
https://batdongsan.com.vn/ban-nha-rieng-duong-hoang-liet-phuong-hoang-liet-8/cc-ban-50m2-oto-7-cho-vao-kinh-doanh-inh-thanh-may-linh-am-ha-noi-pr45683137,Chính Chủ Bán Nhà Linh Đàm- 50m-Oto 7 Chỗ Vào Nhà-Kinh Doanh Đỉnh-Thang Máy-Hoàng Liệt-Hà Nội.,"Đường Hoàng Liệt, Phường Hoàng Liệt, Quận Hoàng Mai, Hà Nội | (Phường Hoàng Liệt, Hà Nội mới)","Đường Hoàng Liệt, Phường Hoàng Liệt, Quận Hoàng Mai, Hà Nội","(Phường Hoàng Liệt, Hà Nội mới)",13 tỷ,~260 triệu/m²,4 phòng,Hoàng Mai,50 m²,5 m,5 m,,,,,Sổ đỏ/ Sổ hồng,12/06/2026,19/06/2026,Tin VIP Kim Cương,45683137,20.9664207978094,105.837514973467
https://batdongsan.com.vn/ban-nha-rieng-pho-hao-nam-phuong-o-cho-dua-3/cc-ban-chdv-12pn-full-nt-pccc-ong-a-pr45682573,Chủ nhà CHDV 12PN-Full NT-PCCC-Hào Nam - Ô Chợ Dừa-Đống Đa-Đã Full Khách Chỉ Vận Hành,"Phố Hào Nam, Phường Ô Chợ Dừa, Quận Đống Đa, Hà Nội | (Phường Đống Đa, Hà Nội mới)","Phố Hào Nam, Phường Ô Chợ Dừa, Quận Đống Đa, Hà Nội","(Phường Đống Đa, Hà Nội mới)","15,05 tỷ","~242,74 triệu/m²",12 phòng,Đống Đa,62 m²,,,,,,,Sổ đỏ/ Sổ hồng,12/06/2026,19/06/2026,Tin VIP Kim Cương,45682573,21.0252589029034,105.827294641835
https://batdongsan.com.vn/ban-dat-xa-xuan-son-5/ban-at-100m2-gia-1-7-ty-tai-truc-chinh-son-tay-ha-noi-l-h-pr45893211,"Bán đất 100m2, giá 1,7 tỷ tại trục chính Xuân Sơn, Sơn Tây, Hà Nội. L/H 0967 821 ***","Xã Xuân Sơn, Thị xã Sơn Tây, Hà Nội | (Phường Tùng Thiện, Hà Nội mới)","Xã Xuân Sơn, Thị xã Sơn Tây, Hà Nội","(Phường Tùng Thiện, Hà Nội mới)","1,7 tỷ",~17 triệu/m²,,Sơn Tây,100 m²,6 m,8 m,,,,,Sổ đỏ/ Sổ hồng,11/06/2026,21/06/2026,Tin VIP Kim Cương,45893211,21.1432882111943,105.429613728734
https://batdongsan.com.vn/ban-dat-duong-21-1-xa-co-dong-16/ban-at-tai-uong-21-oai-phuong-ha-noi-2-6-ty-dien-tich-thuc-te-68m2-tren-so-47-25m-pr45877788,"Bán đất tại đường 21, xã Đoài Phương, Hà Nội, 2,6 tỷ, diện tích thực tế 68m² (trên sổ 47,25m)","Đường 21, Xã Cổ Đông, Thị xã Sơn Tây, Hà Nội | (Xã Đoài Phương, Hà Nội mới)","Đường 21, Xã Cổ Đông, Thị xã Sơn Tây, Hà Nội","(Xã Đoài Phương, Hà Nội mới)","2,6 tỷ","~55,03 triệu/m²",,Sơn Tây,"47,25 m²","4,5 m","6,5 m",Đông - Bắc,,,,Sổ đỏ/ Sổ hồng,08/06/2026,23/06/2026,Tin VIP Kim Cương,45877788,21.0455428019989,105.50619143653
https://batdongsan.com.vn/ban-nha-rieng-duong-ho-tung-mau-phuong-cau-dien-14/toi-can-ban-gap-10-7-ty-gia-thuong-luong-5t-37-39m2-lam-viec-chinh-chu-pr45876752,"Tôi cần bán gấp nhà Hồ Tùng Mậu 10,7 tỷ giá thương lượng 5T 37/39m² làm việc chính chủ","Ngõ 20 Hồ Tùng Mậu, Đường Hồ Tùng Mậu, Phường Cầu Diễn, Quận Nam Từ Liêm, Hà Nội | (Phường Từ Liêm, Hà Nội mới)","Ngõ 20 Hồ Tùng Mậu, Đường Hồ Tùng Mậu, Phường Cầu Diễn, Quận Nam Từ Liêm, Hà Nội","(Phường Từ Liêm, Hà Nội mới)","10,7 tỷ","~289,19 triệu/m²",6 phòng,Nam Từ Liêm,37 m²,,,,,5 tầng,,,08/06/2026,15/06/2026,Tin VIP Kim Cương,45876752,21.0395001757874,105.769525503689
https://batdongsan.com.vn/ban-dat-duong-tinh-lo-446-xa-phu-cat-1-22/at-nen-o-thi-hoa-lac-vi-tri-vang-on-song-phat-trien-phia-tay-ha-noi-pr45777009,Đất nền đô thị khu Hòa Lạc vị trí vàng đón sóng phát triển phía Tây Hà Nội,"Đường Tỉnh Lộ 446, Xã Phú Cát, Huyện Quốc Oai, Hà Nội | (Xã Phú Cát, Hà Nội mới)","Đường Tỉnh Lộ 446, Xã Phú Cát, Huyện Quốc Oai, Hà Nội","(Xã Phú Cát, Hà Nội mới)","3,8 tỷ",~38 triệu/m²,,Quốc Oai,100 m²,"6,8 m",,,,,,Sổ đỏ/ Sổ hồng,31/05/2026,15/06/2026,Tin VIP Kim Cương,45777009,20.9716596948748,105.553367749992
https://batdongsan.com.vn/ban-dat-xa-phuong-son_1/toi-cc-ban-o-at-vuong-ep-nhu-phan-lo-tai-thon-ba-nha-yen-son-nay-la-son-oto-vao-nha-pr45367770,"Tôi bán gấp ô đất vuông như phân lô tại Thôn Ba Nhà, Yên Sơn, nay là Phượng Sơn, ôtô vào nhà","Thôn Ba Nhà, Xã Phượng Sơn, Huyện Quốc Oai, Hà Nội | (Xã Quốc Oai, Hà Nội mới)","Thôn Ba Nhà, Xã Phượng Sơn, Huyện Quốc Oai, Hà Nội","(Xã Quốc Oai, Hà Nội mới)","39,5 triệu/m²","~4,74 tỷ",,Quốc Oai,120 m²,"5,5 m",,Nam,,,,Sổ đỏ/ Sổ hồng,03/06/2026,18/06/2026,Tin VIP Vàng,45367770,20.9898284208873,105.665661637292
https://batdongsan.com.vn/ban-dat-xa-co-dong/can-ban-gap-manh-at-trong-mot-ngay-gia-1-9-ty-dien-tich-68m2-so-o-ha-noi-lh-pr45337817,"Giảm hẳn 2,5 tỷ diện tích 125m sổ đỏ Hà Nội LH 0976 965 ***.","Xã Cổ Đông, Thị xã Sơn Tây, Hà Nội | (Xã Hòa Lạc, Hà Nội mới)","Xã Cổ Đông, Thị xã Sơn Tây, Hà Nội","(Xã Hòa Lạc, Hà Nội mới)","2,5 tỷ",~20 triệu/m²,,Sơn Tây,125 m²,,7 m,,,,,Sổ đỏ/ Sổ hồng,13/06/2026,20/06/2026,Tin VIP Vàng,45337817,21.0594642405368,105.51589889134
https://batdongsan.com.vn/ban-dat-xa-phu-cat-1/ban-nhanh-100m2-gan-chung-cu-phenika-va-chung-cu-legacy-hinori-hoa-lac-pr45888804,Bán nhanh 115.7m2 Phú Cát gần chung cư Phenika và chung cư Legacy Hinori Hoà Lạc,"Xã Phú Cát, Huyện Quốc Oai, Hà Nội | (Xã Phú Cát, Hà Nội mới)","Xã Phú Cát, Huyện Quốc Oai, Hà Nội","(Xã Phú Cát, Hà Nội mới)","3,1 tỷ","~26,79 triệu/m²",,Quốc Oai,"115,7 m²",6 m,7 m,Đông - Nam,,,,Sổ đỏ/ Sổ hồng,10/06/2026,17/06/2026,Tin VIP Vàng,45888804,20.9744031114206,105.552750720103
https://batdongsan.com.vn/ban-dat-xa-thuy-xuan-tien/335m-tho-cu-157m-mat-10m-giua-trung-tam-mai-lo-at-ep-hiem-gap-gia-ang-rat-tot-pr45883444,"335m2 thổ cư 157m2 mặt tiền 10m giữa trung tâm Xuân Mai lô đất đẹp hiếm gặp, giá đang rất tốt!","Xã Thuỷ Xuân Tiên, Huyện Chương Mỹ, Hà Nội | (Xã Xuân Mai, Hà Nội mới)","Xã Thuỷ Xuân Tiên, Huyện Chương Mỹ, Hà Nội","(Xã Xuân Mai, Hà Nội mới)","6,05 tỷ","~18,06 triệu/m²",,Chương Mỹ,335 m²,10 m,5 m,,,,,Sổ đỏ/ Sổ hồng,09/06/2026,16/06/2026,Tin VIP Bạc,45883444,20.8806677516585,105.584861854766
https://batdongsan.com.vn/ban-dat-xa-tan-xa/ban-gap-152m2-manh-at-vang-mat-ho-noi-quy-tu-moi-nhan-tai-cua-at-nuoc-chi-25-ty-bao-so-o-pr45895853,Bán gấp 151m2 mảnh đất vàng mặt hồ Tân Xã nơi quy tụ mọi nhân tài của đất nước chỉ 25 tỷ bao sổ đỏ,"Xã Tân Xã, Huyện Thạch Thất, Hà Nội | (Xã Hòa Lạc, Hà Nội mới)","Xã Tân Xã, Huyện Thạch Thất, Hà Nội","(Xã Hòa Lạc, Hà Nội mới)",25 tỷ,"~165,56 triệu/m²",,Thạch Thất,151 m²,,30 m,,,,,Sổ đỏ/ Sổ hồng,11/06/2026,18/06/2026,Tin VIP Kim Cương,45895853,21.0194789854341,105.545056806069
https://batdongsan.com.vn/ban-dat-duong-quoc-lo-21a-quoc-lo-21-xa-phu-cat-1-22/hiem-goc-sat-ql21a-loi-khu-cnc-hoa-lac-canh-h-gia-h-fpt-so-ep-sieu-mau-chi-1-99-ty-pr45870806,"Hiếm! Lô đất lõi khu CNC Hòa Lạc, sát QL21A, cạnh ĐH Quốc Gia, ĐH FPT, sổ đẹp siêu mẫu, chỉ 20tr/m2","Đường Quốc lộ 21A(Quốc lộ 21), Xã Phú Cát, Huyện Quốc Oai, Hà Nội | (Xã Phú Cát, Hà Nội mới)","Đường Quốc lộ 21A(Quốc lộ 21), Xã Phú Cát, Huyện Quốc Oai, Hà Nội","(Xã Phú Cát, Hà Nội mới)","2,3 tỷ",~20 triệu/m²,,Quốc Oai,115 m²,,,,,,,Sổ đỏ/ Sổ hồng,07/06/2026,14/06/2026,Tin thường,45870806,20.9679982625961,105.535693114548
https://batdongsan.com.vn/ban-dat-duong-vai-reo-xa-phu-cat-1-22/ban-nen-hoa-lac-dai-hoc-quoc-gia-100m2-full-tho-cu-mat-tien-8m-truoc-20m-gia-4ty-pr44693892,"Bán đất nền khu Hoà Lạc - ĐH Quốc gia 100m2 full thổ cư, mặt tiền 8m, đường trước 20m, giá 2.5 tỷ","Đường Vai Réo, Xã Phú Cát, Huyện Quốc Oai, Hà Nội | (Xã Phú Cát, Hà Nội mới)","Đường Vai Réo, Xã Phú Cát, Huyện Quốc Oai, Hà Nội","(Xã Phú Cát, Hà Nội mới)","2,5 tỷ",~25 triệu/m²,,Quốc Oai,100 m²,8 m,20 m,,,,,Sổ đỏ.,11/06/2026,18/06/2026,Tin VIP Kim Cương,44693892,20.9713956192236,105.533626028674
https://batdongsan.com.vn/ban-dat-duong-21-1-xa-co-dong-16/ban-at-tai-uong-21-oai-phuong-ha-noi-2-6-ty-dien-tich-thuc-te-68m2-tren-so-47-25m-pr45877788,"Bán đất tại đường 21, xã Đoài Phương, Hà Nội, 2,6 tỷ, diện tích thực tế 68m² (trên sổ 47,25m)","Đường 21, Xã Cổ Đông, Thị xã Sơn Tây, Hà Nội | (Xã Đoài Phương, Hà Nội mới)","Đường 21, Xã Cổ Đông, Thị xã Sơn Tây, Hà Nội","(Xã Đoài Phương, Hà Nội mới)","2,6 tỷ","~55,03 triệu/m²",,Sơn Tây,"47,25 m²","4,5 m","6,5 m",Đông - Bắc,,,,Sổ đỏ/ Sổ hồng,08/06/2026,23/06/2026,Tin VIP Kim Cương,45877788,21.0455428019989,105.50619143653
https://batdongsan.com.vn/ban-dat-duong-tinh-lo-446-xa-phu-cat-1-22/at-nen-o-thi-hoa-lac-vi-tri-vang-on-song-phat-trien-phia-tay-ha-noi-pr45777009,Đất nền đô thị khu Hòa Lạc vị trí vàng đón sóng phát triển phía Tây Hà Nội,"Đường Tỉnh Lộ 446, Xã Phú Cát, Huyện Quốc Oai, Hà Nội | (Xã Phú Cát, Hà Nội mới)","Đường Tỉnh Lộ 446, Xã Phú Cát, Huyện Quốc Oai, Hà Nội","(Xã Phú Cát, Hà Nội mới)","3,8 tỷ",~38 triệu/m²,,Quốc Oai,100 m²,"6,8 m",,,,,,Sổ đỏ/ Sổ hồng,31/05/2026,15/06/2026,Tin VIP Kim Cương,45777009,20.9716596948748,105.553367749992
https://batdongsan.com.vn/ban-dat-xa-phuong-son_1/toi-cc-ban-o-at-vuong-ep-nhu-phan-lo-tai-thon-ba-nha-yen-son-nay-la-son-oto-vao-nha-pr45367770,"Tôi bán gấp ô đất vuông như phân lô tại Thôn Ba Nhà, Yên Sơn, nay là Phượng Sơn, ôtô vào nhà","Thôn Ba Nhà, Xã Phượng Sơn, Huyện Quốc Oai, Hà Nội | (Xã Quốc Oai, Hà Nội mới)","Thôn Ba Nhà, Xã Phượng Sơn, Huyện Quốc Oai, Hà Nội","(Xã Quốc Oai, Hà Nội mới)","39,5 triệu/m²","~4,74 tỷ",,Quốc Oai,120 m²,"5,5 m",,Nam,,,,Sổ đỏ/ Sổ hồng,03/06/2026,18/06/2026,Tin VIP Vàng,45367770,20.9898284208873,105.665661637292
https://batdongsan.com.vn/ban-dat-duong-tu-hiep-xa-tu-hiep-13/ban-lo-at-70m2-hang-xom-truc-song-hong-pr45836559,"Bán lô đất 70m2, hàng xóm trục sông Hồng","Số 2, làng Đồng Trì, đường Tứ Hiệp, Xã Tứ Hiệp, Huyện Thanh Trì, Hà Nội | (Xã Thanh Trì, Hà Nội mới)","Số 2, làng Đồng Trì, đường Tứ Hiệp, Xã Tứ Hiệp, Huyện Thanh Trì, Hà Nội","(Xã Thanh Trì, Hà Nội mới)",120 triệu/m²,"~8,4 tỷ",,Thanh Trì,70 m²,"4,3 m",7 m,Tây - Bắc,,,,Sổ đỏ/ Sổ hồng,13/06/2026,23/06/2026,Tin VIP Vàng,45836559,20.9416158609878,105.862041993409
https://batdongsan.com.vn/ban-dat-duong-hoa-thach-xa-hoa-thach-22/ban-tai-phu-cat-quoc-oai-ha-noi-chi-tu-2-4-ty-100m2-pr44917889,"Bán đất tại (Hòa Thạch), xã Phú Cát, Quốc Oai, Hà Nội, chỉ 2,5 tỷ, 103.7m2 0977 514 ***","Đường Hoà Thạch, Xã Hòa Thạch, Huyện Quốc Oai, Hà Nội | (Xã Phú Cát, Hà Nội mới)","Đường Hoà Thạch, Xã Hòa Thạch, Huyện Quốc Oai, Hà Nội","(Xã Phú Cát, Hà Nội mới)","2,5 tỷ","~24,11 triệu/m²",,Quốc Oai,"103,7 m²",5 m,6 m,Đông - Nam,,,,Sổ đỏ/ Sổ hồng,12/06/2026,22/06/2026,Tin VIP Vàng,44917889,20.9475731068811,105.564637767197
https://batdongsan.com.vn/ban-dat-xa-phu-cat-1/ban-nhanh-100m2-gan-chung-cu-phenika-va-chung-cu-legacy-hinori-hoa-lac-pr45888804,Bán nhanh 115.7m2 Phú Cát gần chung cư Phenika và chung cư Legacy Hinori Hoà Lạc,"Xã Phú Cát, Huyện Quốc Oai, Hà Nội | (Xã Phú Cát, Hà Nội mới)","Xã Phú Cát, Huyện Quốc Oai, Hà Nội","(Xã Phú Cát, Hà Nội mới)","3,1 tỷ","~26,79 triệu/m²",,Quốc Oai,"115,7 m²",6 m,7 m,Đông - Nam,,,,Sổ đỏ/ Sổ hồng,10/06/2026,17/06/2026,Tin VIP Vàng,45888804,20.9744031114206,105.552750720103
https://batdongsan.com.vn/ban-dat-duong-phu-xa-phuong-phu-thuong-1-6/hang-hiem-chinh-chu-90m-at-phan-lo-so-o-san-giao-dich-pr45899785,"Hàng hiếm chính chủ - 90m đất phân lô Phú Xá, sổ đỏ sẵn giao dịch","Đường Phú Xá, Phường Phú Thượng, Quận Tây Hồ, Hà Nội | (Phường Phú Thượng, Hà Nội mới)","Đường Phú Xá, Phường Phú Thượng, Quận Tây Hồ, Hà Nội","(Phường Phú Thượng, Hà Nội mới)",15 tỷ,"~166,67 triệu/m²",,Tây Hồ,90 m²,,,,,,,,12/06/2026,19/06/2026,Tin VIP Bạc,45899785,21.0901510509554,105.811302485285
https://batdongsan.com.vn/ban-dat-xa-phu-nghia-1/ban-at-sat-ql-6-kcn-chuong-my-ha-noi-85-trieu-m2-co-tl-dien-tich-360-m2-pr45898526,"Bán đất sát QL 6 KCN Phú Nghĩa, Chương Mỹ, Hà Nội 85 triệu / m2 có TL, diện tích 360 m2","Xã Phú Nghĩa, Huyện Chương Mỹ, Hà Nội | (Xã Phú Nghĩa, Hà Nội mới)","Xã Phú Nghĩa, Huyện Chương Mỹ, Hà Nội","(Xã Phú Nghĩa, Hà Nội mới)",85 triệu/m²,"~30,6 tỷ",,Chương Mỹ,360 m²,13 m,10 m,Đông,,,,Sổ đỏ/ Sổ hồng,12/06/2026,19/06/2026,Tin VIP Bạc,45898526,20.9281937774308,105.659966211843
https://batdongsan.com.vn/ban-dat-xa-bat-trang-1/can-ban-gap-at-dtich-450m-mt-13-5m-kinh-doanh-tot-so-o-san-giao-dich-pr45743073,"Cần Bán Gấp Đất Bát Tràng Dtich 450m / MT 13,5m kinh doanh tốt , Sổ đỏ sẵn giao dịch","Xã Bát Tràng, Huyện Gia Lâm, Hà Nội | (Xã Bát Tràng, Hà Nội mới)","Xã Bát Tràng, Huyện Gia Lâm, Hà Nội","(Xã Bát Tràng, Hà Nội mới)",Thỏa thuận,,,Gia Lâm,450 m²,"13,5 m",12 m,Đông - Nam,,,,Sổ đỏ/ Sổ hồng,12/06/2026,19/06/2026,Tin VIP Bạc,45743073,20.9797544346899,105.917522987633
https://batdongsan.com.vn/ban-dat-xa-co-dong/chinh-chu-ban-gap-2-mat-tien-124m2-lo-goc-trung-tam-hoa-lac-gia-3-ty-pr45899522,"CHÍNH CHỦ BÁN GẤP 2 MẶT TIỀN 124M2 LÔ GÓC TRUNG TÂM HÒA LẠC, GIÁ 3 TỶ","Xã Cổ Đông, Thị xã Sơn Tây, Hà Nội | (Xã Đoài Phương, Hà Nội mới)","Xã Cổ Đông, Thị xã Sơn Tây, Hà Nội","(Xã Đoài Phương, Hà Nội mới)",3 tỷ,"~24,19 triệu/m²",,Sơn Tây,124 m²,,,,,,,,12/06/2026,22/06/2026,Tin VIP Bạc,45899522,21.0594613350815,105.515681582426
https://batdongsan.com.vn/ban-nha-rieng-pho-thai-ha-phuong-lang-ha-3/ban-toa-van-phong-phan-lo-150m2-9t-ay-u-pccc-hoan-cong-via-he-o-to-2-chieu-pr45899266,"Bán tòa nhà văn phòng phân lô phố Thái Hà, 150m², 9T, đầy đủ PCCC, hoàn công, vỉa hè, ô tô 2 chiều","Phố Thái Hà, Phường Láng Hạ, Quận Đống Đa, Hà Nội | (Phường Đống Đa, Hà Nội mới)","Phố Thái Hà, Phường Láng Hạ, Quận Đống Đa, Hà Nội","(Phường Đống Đa, Hà Nội mới)","92,8 tỷ","~618,67 triệu/m²",,Đống Đa,150 m²,,,,,9 tầng,,Sổ đỏ/ Sổ hồng,12/06/2026,19/06/2026,Tin VIP Bạc,45899266,21.0144962053363,105.816994509455
https://batdongsan.com.vn/ban-nha-rieng-duong-quynh-do-xa-vinh-quynh-13/ban-o-thanh-tri-56-6m2x4-tang-lo-goc-san-cong-7-x-ty-pr45899160,"Bán nhà Quỳnh Đô / Vĩnh Quỳnh / Thanh Trì 56,6m2x3 tầng, lô góc, sân cổng riêng 7,x tỷ","đường Quỳnh Đô, Xã Vĩnh Quỳnh, Huyện Thanh Trì, Hà Nội | (Xã Đại Thanh, Hà Nội mới)","đường Quỳnh Đô, Xã Vĩnh Quỳnh, Huyện Thanh Trì, Hà Nội","(Xã Đại Thanh, Hà Nội mới)","7,19 tỷ","~127,03 triệu/m²",4 phòng,Thanh Trì,"56,6 m²","4,5 m","2,5 m",,,3 tầng,,Sổ đỏ/ Sổ hồng,12/06/2026,19/06/2026,Tin VIP Bạc,45899160,20.9377219644912,105.836453581872
https://batdongsan.com.vn/ban-nha-rieng-duong-doi-can-phuong-ngoc-ha-2/ko-qh-oi-2-thoang-ngo-thong-50m-ra-o-to-tranh-ep-view-ho-so-cc-46m2-pr45898937,"Ko QH! Đội Cấn - Ngọc Hà, 2 thoáng, ngõ thông, 50m ra ô tô tránh, nhà đẹp, view hồ, sổ CC, 46m2","Đường Đội Cấn, Phường Ngọc Hà, Quận Ba Đình, Hà Nội | (Phường Ba Đình, Hà Nội mới)","Đường Đội Cấn, Phường Ngọc Hà, Quận Ba Đình, Hà Nội","(Phường Ba Đình, Hà Nội mới)","8,67 tỷ","~188,48 triệu/m²",3 phòng,Ba Đình,46 m²,,,,,5 tầng,,Sổ đỏ/ Sổ hồng,12/06/2026,19/06/2026,Tin VIP Bạc,45898937,21.0349376082343,105.82304337449
https://batdongsan.com.vn/ban-nha-rieng-pho-gia-quat-phuong-ngoc-lam-2-9/mat-dt-125m-mt-7-3m-uong-3-oto-tranh-kinh-doanh-chi-hon-17-ty-pr45643647,Ngọc Lâm phố Gia Quất - sổ đỏ 125m2 vỉa hè ô tô tránh kinh doanh - mặt tiền 7m3 hơn 16 tỷ,"52, Phố Gia Quất, Phường Ngọc Lâm, Quận Long Biên, Hà Nội | (Phường Bồ Đề, Hà Nội mới)","52, Phố Gia Quất, Phường Ngọc Lâm, Quận Long Biên, Hà Nội","(Phường Bồ Đề, Hà Nội mới)","16,6 tỷ","~132,8 triệu/m²",1 phòng,Long Biên,125 m²,"7,3 m",8 m,,,1 tầng,,Sổ đỏ/ Sổ hồng,12/06/2026,19/06/2026,Tin VIP Bạc,45643647,21.0553149918702,105.88061765232
https://batdongsan.com.vn/ban-nha-rieng-duong-y-la-phuong-duong-noi-15/ban-4tx33m2-lo-goc-mat-ngo-nuoc-cach-100m-ra-cho-gia-chi-hon-4-ty-pr43191599,"Bán nhà 5Tx33m2 ôtô đỗ gần Tại Ỷ La Dương Nội, cách vòng xuyến Lê Trọng Tấn 1km giá Chỉ Hơn 5 tỷ.","Ngõ 164, Đường Ỷ La, Phường Dương Nội, Quận Hà Đông, Hà Nội | (Phường Dương Nội, Hà Nội mới)","Ngõ 164, Đường Ỷ La, Phường Dương Nội, Quận Hà Đông, Hà Nội","(Phường Dương Nội, Hà Nội mới)","5,2 tỷ","~152,94 triệu/m²",3 phòng,Hà Đông,34 m²,5 m,3 m,,,5 tầng,,Sổ đỏ/ Sổ hồng,12/06/2026,27/06/2026,Tin VIP Bạc,43191599,20.9708176940481,105.74690382589
https://batdongsan.com.vn/ban-nha-rieng-duong-ho-tung-mau-phuong-cau-dien-14/toa-can-dong-tien-135m2-doanh-thu-350-trieu-thang-gia-6x-ty-pr45891817,"Tòa căn hộ dòng tiền Hồ Tùng Mậu 135m2, doanh thu 350 triệu/tháng, giá 6x tỷ","196 hồ tùng mậu, Đường Hồ Tùng Mậu, Phường Cầu Diễn, Quận Nam Từ Liêm, Hà Nội | (Phường Từ Liêm, Hà Nội mới)","196 hồ tùng mậu, Đường Hồ Tùng Mậu, Phường Cầu Diễn, Quận Nam Từ Liêm, Hà Nội","(Phường Từ Liêm, Hà Nội mới)",Thỏa thuận,,30 phòng,Nam Từ Liêm,135 m²,5 m,11 m,,,,,Sổ đỏ/ Sổ hồng,11/06/2026,18/06/2026,Tin VIP Vàng,45891817,21.039007616167,105.769672253655
https://batdongsan.com.vn/ban-dat-duong-kim-au-xa-dang-xa-11/ban-oc-quyen-3-lo-at-sieu-ep-ang-thuan-an-gia-lam-uong-o-to-tranh-pr45713014,"Bán độc quyền 3 lô đất siêu đẹp Đặng Xá, Thuận An Gia Lâm, đường ô tô tránh","Đường Kim Âu, Xã Đặng Xá, Huyện Gia Lâm, Hà Nội | (Xã Thuận An, Hà Nội mới)","Đường Kim Âu, Xã Đặng Xá, Huyện Gia Lâm, Hà Nội","(Xã Thuận An, Hà Nội mới)",95 triệu/m²,"~7,6 tỷ",,Gia Lâm,80 m²,7 m,7 m,Tây - Bắc,,,,Sổ đỏ/ Sổ hồng,09/06/2026,16/06/2026,Tin VIP Vàng,45713014,21.0232553777258,105.95942436661
