Link,Tiêu đề,Địa chỉ,Địa chỉ 1,Địa chỉ 2,Mức giá,Giá/m²,Số phòng ngủ,Huyện,Diện tích,Mặt tiền,Đường vào,Hướng nhà,Hướng ban công,Số tầng,Số toilet,Pháp lý,Ngày đăng,Ngày hết hạn,Loại tin,Mã tin,Latitude,Longitude
https://batdongsan.com.vn/ban-dat-duong-bac-hong-xa-bac-hong-1-10/ban-53m2-bia-lang-thon-my-noi-phuc-thinh-ha-noi-truoc-qh-rong-17-5m-pr44741162,"Bán mảnh 52.7m2 đất đẹp - vị trí vàng tại bìa làng thôn Mỹ Nội, xã Phúc Thịnh, Hà Nội","thôn Mỹ Nội, Đường Bắc Hồng, Xã Bắc Hồng, Huyện Đông Anh, Hà Nội | (Xã Phúc Thịnh, Hà Nội mới)","thôn Mỹ Nội, Đường Bắc Hồng, Xã Bắc Hồng, Huyện Đông Anh, Hà Nội","(Xã Phúc Thịnh, Hà Nội mới)",115 triệu/m²,"~6,06 tỷ",,Đông Anh,"52,7 m²","4,03 m","17,5 m",Tây - Bắc,,,,Sổ đỏ/ Sổ hồng.,12/06/2026,27/06/2026,Tin thường,44741162,21.1771964244745,105.802548449316
https://batdongsan.com.vn/ban-dat-duong-quoc-lo-21a-quoc-lo-21-xa-co-dong-16/ban-dep-bam-truc-chinh-trai-lang-2-8-ty-100m2-pr44048552,"Bán đất đẹp bám trục chính Trại Láng Cổ Đông Quốc lộ 21A, 2,8 tỷ, 100m2 0977 514 ***","Đường Quốc lộ 21A(Quốc lộ 21), Xã Cổ Đông, Thị xã Sơn Tây, Hà Nội | (Xã Đoài Phương, Hà Nội mới)","Đường Quốc lộ 21A(Quốc lộ 21), Xã Cổ Đông, Thị xã Sơn Tây, Hà Nội","(Xã Đoài Phương, Hà Nội mới)","2,8 tỷ",~28 triệu/m²,,Sơn Tây,100 m²,5 m,6 m,Đông - Nam,,,,Sổ đỏ/ Sổ hồng,12/06/2026,12/07/2026,Tin thường,44048552,21.0459706504868,105.506678958672
https://batdongsan.com.vn/ban-dat-duong-khe-nu-xa-nguyen-khe-10/ban-at-dt-408-6m2-tai-phuc-thinh-ha-noi-pr45898652,"Bán đất DT: 408,6m² tại Khê Nữ, Phúc Thịnh, Hà Nội","Đường Khê Nữ, Xã Nguyên Khê, Huyện Đông Anh, Hà Nội | (Xã Phúc Thịnh, Hà Nội mới)","Đường Khê Nữ, Xã Nguyên Khê, Huyện Đông Anh, Hà Nội","(Xã Phúc Thịnh, Hà Nội mới)",75 triệu/m²,"~30,64 tỷ",,Đông Anh,"408,6 m²","14,68 m",6 m,Đông - Nam,,,,Sổ đỏ/ Sổ hồng,12/06/2026,27/06/2026,Tin thường,45898652,21.1783648971548,105.831413571619
https://batdongsan.com.vn/ban-dat-duong-quoc-lo-21a-quoc-lo-21-xa-co-dong-16/chinh-chu-ban-gap-at-hoa-lac-bam-21-100m2-cong-hqg-chi-2-6-ty-goc-pr45334684,Chính chủ gửi bán gấp đất Đoài Phương bám quốc lộ 21 100m² cổng ĐHQG chỉ 2.6 tỷ lô góc 0977 514 ***,"Đường Quốc lộ 21A(Quốc lộ 21), Xã Cổ Đông, Thị xã Sơn Tây, Hà Nội | (Xã Đoài Phương, Hà Nội mới)","Đường Quốc lộ 21A(Quốc lộ 21), Xã Cổ Đông, Thị xã Sơn Tây, Hà Nội","(Xã Đoài Phương, Hà Nội mới)","2,6 tỷ",~26 triệu/m²,,Sơn Tây,100 m²,6 m,6 m,Đông - Nam,,,,Sổ đỏ/ Sổ hồng,12/06/2026,12/07/2026,Tin thường,45334684,21.0457230815673,105.507307575765
https://batdongsan.com.vn/ban-dat-duong-5-xa-hai-boi-10/ban-dau-gia-x2-dong-nhan-gan-tt-hanh-chinh-vinh-thanh-moi-va-du-an-tp-thong-minh-pr43715540,"Bán đất đấu giá X2 Đồng Nhân, Hải Bối - gần TT hành chính xã Vĩnh Thanh và dự án TP Thông Minh mới","Đường 5, Xã Hải Bối, Huyện Đông Anh, Hà Nội | (Xã Vĩnh Thanh, Hà Nội mới)","Đường 5, Xã Hải Bối, Huyện Đông Anh, Hà Nội","(Xã Vĩnh Thanh, Hà Nội mới)",165 triệu/m²,"~13,2 tỷ",,Đông Anh,80 m²,5 m,8 m,Đông,,,,Sổ đỏ/ Sổ hồng.,12/06/2026,27/06/2026,Tin thường,43715540,21.1246253065749,105.79929530618
https://batdongsan.com.vn/ban-nha-rieng-duong-tran-duy-hung-phuong-trung-hoa-4-7/yen-cau-giay-49m-5-tang-thang-may-o-to-qua-cua-12-5-ty-pr45452788,Nhà phường Yên Hoà Cầu Giấy - 49m2 5 tầng thang máy - ô tô qua cửa 12.5 tỷ,"Đường Trần Duy Hưng, Phường Trung Hòa, Quận Cầu Giấy, Hà Nội | (Phường Yên Hòa, Hà Nội mới)","Đường Trần Duy Hưng, Phường Trung Hòa, Quận Cầu Giấy, Hà Nội","(Phường Yên Hòa, Hà Nội mới)","12,5 tỷ","~255,1 triệu/m²",4 phòng,Cầu Giấy,49 m²,7 m,,,,5 tầng,,Sổ đỏ/ Sổ hồng,12/06/2026,12/07/2026,Tin thường,45452788,21.0105467257848,105.799540839778
https://batdongsan.com.vn/ban-nha-rieng-duong-tran-duy-hung-phuong-trung-hoa-4-7/trong-vanh-ai-2-5-lo-goc-cau-giay-48m-6t-thang-may-5m-ra-ngo-vf5-thong-kinh-pr45694318,(Trong vành đai 2.5) Lô góc Cầu Giấy 48m - 6T thang máy - 5m ra ngõ VF5 - thông Trung Kính,"Đường Trần Duy Hưng, Phường Trung Hòa, Quận Cầu Giấy, Hà Nội | (Phường Yên Hòa, Hà Nội mới)","Đường Trần Duy Hưng, Phường Trung Hòa, Quận Cầu Giấy, Hà Nội","(Phường Yên Hòa, Hà Nội mới)","13,3 tỷ","~277,08 triệu/m²",3 phòng,Cầu Giấy,48 m²,8 m,,,,6 tầng,,Sổ đỏ/ Sổ hồng,12/06/2026,27/06/2026,Tin thường,45694318,21.0108552298322,105.79971010455
https://batdongsan.com.vn/ban-nha-rieng-duong-nguyen-luong-bang-1-phuong-nam-dong-3/tran-huu-tuoc-ong-a-7-tang-thang-may-gan-ho-ac-di-pr45717214,Nguyễn Lương Bằng thông Trần Hữu Tước ra hồ - Đống Đa | 7 tầng thang máy - Gần Hồ Đắc Di,"Đường Nguyễn Lương Bằng, Phường Nam Đồng, Quận Đống Đa, Hà Nội | (Phường Đống Đa, Hà Nội mới)","Đường Nguyễn Lương Bằng, Phường Nam Đồng, Quận Đống Đa, Hà Nội","(Phường Đống Đa, Hà Nội mới)","11,3 tỷ","~289,74 triệu/m²",4 phòng,Đống Đa,39 m²,,,,,7 tầng,,Sổ đỏ/ Sổ hồng,12/06/2026,27/06/2026,Tin thường,45717214,21.0161461452808,105.828470343817
https://batdongsan.com.vn/ban-nha-rieng-pho-phao-dai-lang-phuong-lang-thuong-3/60m2-ai-sat-nguyen-chi-thanh-mt-5-3m-18-5-ty-pr45452003,"Nhà 60m2 Pháo Đài Láng sát Nguyễn Chí Thanh MT 5.3m - 18,5 tỷ","Phố Pháo Đài Láng, Phường Láng Thượng, Quận Đống Đa, Hà Nội | (Phường Láng, Hà Nội mới)","Phố Pháo Đài Láng, Phường Láng Thượng, Quận Đống Đa, Hà Nội","(Phường Láng, Hà Nội mới)","18,5 tỷ","~308,33 triệu/m²",5 phòng,Đống Đa,60 m²,"5,3 m",,,,5 tầng,,Có sổ.,12/06/2026,27/06/2026,Tin thường,45452003,21.0199256988618,105.806697505677
https://batdongsan.com.vn/ban-dat-duong-dong-dau-1-xa-duc-tu-10/sieu-pham-100m2-at-truc-chinh-thon-ong-ong-anh-tp-ha-noi-on-song-vin-yen-thuong-pr45803528,"Siêu phẩm 100m2 đất trục chính thôn Đồng Dầu, xã Đông Anh, TP Hà Nội - đón sóng Vin Yên Thường","Đường Đồng Dầu, Xã Dục Tú, Huyện Đông Anh, Hà Nội | (Xã Đông Anh, Hà Nội mới)","Đường Đồng Dầu, Xã Dục Tú, Huyện Đông Anh, Hà Nội","(Xã Đông Anh, Hà Nội mới)",155 triệu/m²,"~15,5 tỷ",,Đông Anh,100 m²,5 m,10 m,Tây - Bắc,,,,Sổ đỏ/ Sổ hồng,12/06/2026,27/06/2026,Tin thường,45803528,21.1024702220346,105.896730981767
https://batdongsan.com.vn/ban-nha-rieng-duong-tran-quang-dieu-phuong-o-cho-dua-3/sieu-pham-hoang-cau-60m2-mt-6m-7-tang-thang-may-gara-to-kinh-doanh-vip-pr44273860,"Siêu phẩm Trần Quang Diệu Hoàng Cầu XD 60m2 MT 6m 7 tầng thang máy - Gara ô tô - Kinh doanh, ở VIP","Đường Trần Quang Diệu, Phường Ô Chợ Dừa, Quận Đống Đa, Hà Nội | (Phường Đống Đa, Hà Nội mới)","Đường Trần Quang Diệu, Phường Ô Chợ Dừa, Quận Đống Đa, Hà Nội","(Phường Đống Đa, Hà Nội mới)",24 tỷ,~600 triệu/m²,5 phòng,Đống Đa,40 m²,6 m,8 m,,,7 tầng,,Sổ đỏ/ Sổ hồng,12/06/2026,27/06/2026,Tin thường,44273860,21.0155940043556,105.824497136569
https://batdongsan.com.vn/ban-nha-rieng-pho-hoang-cau-phuong-o-cho-dua-3/sieu-pham-phan-lo-61-50m2-6-tang-to-tranh-kinh-doanh-vi-tri-ac-ia-hiem-pr45618951,Siêu phẩm phân lô 61 Hoàng Cầu - 50m2 6 tầng - Ô tô tránh - Kinh doanh - Vị trí đắc địa - Hiếm!,"61 , Phố Hoàng Cầu, Phường Ô Chợ Dừa, Quận Đống Đa, Hà Nội | (Phường Ô Chợ Dừa, Hà Nội mới)","61 , Phố Hoàng Cầu, Phường Ô Chợ Dừa, Quận Đống Đa, Hà Nội","(Phường Ô Chợ Dừa, Hà Nội mới)","22,3 tỷ",~446 triệu/m²,,Đống Đa,50 m²,,12 m,,,6 tầng,,Sổ đỏ/ Sổ hồng,12/06/2026,27/06/2026,Tin thường,45618951,21.0167118299863,105.822742042577
https://batdongsan.com.vn/ban-nha-rieng-duong-minh-khai-phuong-minh-khai-4/sieu-hiem-6-ty-3-ngu-2-thoang-ngo-thong-so-khong-quy-hoach-tang-noi-that-pr45898137,"Siêu hiếm! Minh Khai 6 tỷ 3 ngủ 2 thoáng, ngõ thông, sổ riêng, không quy hoạch, tặng nội thất","ngõ Hòa Bình 7, Đường Minh Khai, Phường Minh Khai, Quận Hai Bà Trưng, Hà Nội | (Phường Bạch Mai, Hà Nội mới)","ngõ Hòa Bình 7, Đường Minh Khai, Phường Minh Khai, Quận Hai Bà Trưng, Hà Nội","(Phường Bạch Mai, Hà Nội mới)","6,3 tỷ",~210 triệu/m²,,Hai Bà Trưng,30 m²,,,,,5 tầng,,Sổ đỏ/ Sổ hồng,12/06/2026,27/06/2026,Tin thường,45898137,20.9947732965304,105.856862939065
https://batdongsan.com.vn/ban-dat-xa-co-bi-1/chi-125tr-m-so-huu-ngay-66m-at-au-gia-thon-vang-gia-lam-mat-tien-10m-sieu-hiem-pr45898041,"Chỉ 125tr/m2 sở hữu ngay 66m2 đất đấu giá thôn Vàng - Cổ Bi - Gia Lâm, mặt tiền 10m siêu hiếm","thôn Vàng, Xã Cổ Bi, Huyện Gia Lâm, Hà Nội | (Xã Gia Lâm, Hà Nội mới)","thôn Vàng, Xã Cổ Bi, Huyện Gia Lâm, Hà Nội","(Xã Gia Lâm, Hà Nội mới)",125 triệu/m²,"~8,25 tỷ",,Gia Lâm,66 m²,10 m,6 m,,,,,Sổ đỏ/ Sổ hồng,12/06/2026,27/06/2026,Tin thường,45898041,21.0322390915473,105.942146491047
https://batdongsan.com.vn/ban-dat-duong-tinh-lo-413-xa-ba-trai-18/tren-ty-at-hon-200m2-tai-gan-uy-ban-suoi-hai-uong-vao-to-rong-o-hay-xay-cho-thue-ven-o-pr45279338,"Trên tỷ lô đất hơn 200m2 tại gần uỷ ban xã Suối Hai, đường vào to rộng, ở hay xây cho thuê ven đô","Đường Tỉnh lộ 413, Xã Ba Trại, Huyện Ba Vì, Hà Nội | (Xã Bất Bạt, Hà Nội mới)","Đường Tỉnh lộ 413, Xã Ba Trại, Huyện Ba Vì, Hà Nội","(Xã Bất Bạt, Hà Nội mới)","1,3 tỷ","~6,49 triệu/m²",,Ba Vì,"200,2 m²",,,,,,,Có sổ,09/06/2026,24/06/2026,Tin thường,45279338,21.1270803016005,105.359764579175
https://batdongsan.com.vn/ban-dat-duong-dh09-xa-phu-cat-1-22/tai-chinh-nhinh-3-ty-tim-au-ra-100m2-trung-tam-ung-50m-ra-ddh09-h-giao-thong-van-tai-pr45852611,"Tài chính 3,3 tỷ tìm đâu ra 100m2 trung tâm Phú Cát - Đúng 50m ra ĐH09 & ĐH Giao Thông Vận Tải","Đường DH09, Xã Phú Cát, Huyện Quốc Oai, Hà Nội | (Xã Phú Cát, Hà Nội mới)","Đường DH09, Xã Phú Cát, Huyện Quốc Oai, Hà Nội","(Xã Phú Cát, Hà Nội mới)","3,3 tỷ",~33 triệu/m²,,Quốc Oai,100 m²,,,,,,,Sổ đỏ/ Sổ hồng,04/06/2026,19/06/2026,Tin thường,45852611,20.9714705653988,105.558031111893
https://batdongsan.com.vn/ban-dat-phuong-giang-bien-1/ban-lo-at-au-gia-ep-nhat-long-vi-tri-vang-phap-ly-chuan-gia-tot-chot-nhanh-pr45513492,Bán lô đất đấu giá đẹp nhất Giang Biên - Long Biên! Vị trí vàng pháp lý chuẩn giá tốt chốt nhanh,"Phường Giang Biên, Quận Long Biên, Hà Nội | (Phường Việt Hưng, Hà Nội mới)","Phường Giang Biên, Quận Long Biên, Hà Nội","(Phường Việt Hưng, Hà Nội mới)",230 triệu/m²,"~19,96 tỷ",,Long Biên,"86,8 m²",,5 m,Đông - Nam,,,,"Sổ đỏ, sổ hồng",12/06/2026,27/06/2026,Tin thường,45513492,21.0677893808306,105.913619907358
https://batdongsan.com.vn/ban-dat-duong-dao-duy-tung-xa-co-loa-10/ban-at-gan-ai-bi-thi-tran-ong-anh-33-5m2-mt-3-95m-gan-cho-toa-huyen-uy-khu-3ha-am-thuc-pr45758602,"Bán đất gần Đài Bi thị trấn Đông Anh 33,4m2 MT 3,95m gần chợ Tóa huyện ủy khu 3ha ẩm thực","Đường Đào Duy Tùng, Xã Cổ Loa, Huyện Đông Anh, Hà Nội | (Xã Đông Anh, Hà Nội mới)","Đường Đào Duy Tùng, Xã Cổ Loa, Huyện Đông Anh, Hà Nội","(Xã Đông Anh, Hà Nội mới)","2,95 tỷ","~88,32 triệu/m²",,Đông Anh,"33,4 m²","3,95 m",,,,,,Sổ đỏ/ Sổ hồng,12/06/2026,27/06/2026,Tin thường,45758602,21.1154386064179,105.866419378133
https://batdongsan.com.vn/ban-dat-duong-thach-ban-phuong-thach-ban-1-9/long-bien-at-tang-nha-2-tang-ngo-thong-o-to-5-cho-pr45375741,"Thạch Bàn Long Biên, bán đất tặng nhà 2 tầng, ngõ thông ô tô 5 chỗ","Đường Thạch Bàn, Phường Thạch Bàn, Quận Long Biên, Hà Nội | (Phường Long Biên, Hà Nội mới)","Đường Thạch Bàn, Phường Thạch Bàn, Quận Long Biên, Hà Nội","(Phường Long Biên, Hà Nội mới)","4,95 tỷ","~215,22 triệu/m²",,Long Biên,23 m²,"3,95 m",3 m,,,,,Có sổ.,12/06/2026,27/06/2026,Tin thường,45375741,21.0250228052017,105.907900139653
https://batdongsan.com.vn/ban-nha-rieng-duong-co-linh-phuong-thach-ban-1-9/mo-3-can-50m-x-6-tang-thang-may-o-to-gia-chi-tu-hon-8-ty-can-tai-linh-pr43902932,"Bán nhà Thạch Bàn - Cổ Linh, lô góc 50m2 x 6 tầng thang máy - Ngõ thông ô tô vào nhà","Đường Cổ Linh, Phường Thạch Bàn, Quận Long Biên, Hà Nội | (Phường Long Biên, Hà Nội mới)","Đường Cổ Linh, Phường Thạch Bàn, Quận Long Biên, Hà Nội","(Phường Long Biên, Hà Nội mới)","9,95 tỷ",~199 triệu/m²,3 phòng,Long Biên,50 m²,"5,5 m",,,,6 tầng,,Sổ đỏ/ Sổ hồng,12/06/2026,27/06/2026,Tin thường,43902932,21.0241815162605,105.90220999805
https://batdongsan.com.vn/ban-nha-rieng-duong-nguyen-hong-phuong-lang-ha-3/hiem-45m2-7-tang-thang-may-kinh-doanh-via-he-sieu-pham-hiem-co-vi-tri-dac-dia-pr45078669,Hiếm! Nguyên Hồng - 45m2 7 tầng thang máy - Kinh doanh vỉa hè - Siêu phẩm hiếm có - Vị trí đắc địa,"Đường Nguyên Hồng, Phường Láng Hạ, Quận Đống Đa, Hà Nội | (Phường Láng, Hà Nội mới)","Đường Nguyên Hồng, Phường Láng Hạ, Quận Đống Đa, Hà Nội","(Phường Láng, Hà Nội mới)","23,5 tỷ","~573,17 triệu/m²",5 phòng,Đống Đa,41 m²,,,,,7 tầng,,Sổ đỏ/ Sổ hồng,12/06/2026,27/06/2026,Tin thường,45078669,21.0156602484721,105.810046353995
https://batdongsan.com.vn/ban-dat-xa-ba-trai/lo-at-nghi-duong-2-mat-tien-tuyet-ep-tai-cach-tl87-vai-tram-met-view-nui-canh-homestay-pr45194759,"Lô đất nghỉ dưỡng 2 mặt tiền tuyệt đẹp tại Ba Trại, cách TL87 vài trăm mét, view núi, cạnh homestay","Xã Ba Trại, Huyện Ba Vì, Hà Nội | (Xã Suối Hai, Hà Nội mới)","Xã Ba Trại, Huyện Ba Vì, Hà Nội","(Xã Suối Hai, Hà Nội mới)","2,75 tỷ","~3,95 triệu/m²",,Ba Vì,"695,7 m²",,,,,,,Sổ đỏ/ Sổ hồng,12/06/2026,27/06/2026,Tin thường,45194759,21.1264135434847,105.351574378983
https://batdongsan.com.vn/ban-dat-xa-tan-linh/at-san-ao-bam-suoi-co-26m-bam-truc-uong-toi-kdl-ao-vua-cach-uong-vanh-ai-du-lich-30m-pr45699999,"Đất Tản Lĩnh sẵn ao, bám suối có 26m bám trục đường tới KDL Ao Vua, cách đường vành đai du lịch 30m","Cua Chu, Xã Tản Lĩnh, Huyện Ba Vì, Hà Nội | (Xã Suối Hai, Hà Nội mới)","Cua Chu, Xã Tản Lĩnh, Huyện Ba Vì, Hà Nội","(Xã Suối Hai, Hà Nội mới)","10,7 tỷ","~6,42 triệu/m²",,Ba Vì,"1.667,5 m²",26 m,,,,,,Sổ đỏ/ Sổ hồng.,12/06/2026,27/06/2026,Tin thường,45699999,21.1106051693826,105.392676935781
https://batdongsan.com.vn/ban-nha-rieng-duong-nguyen-hong-phuong-lang-ha-3/sieu-pham-65m-mt-5-5m-mat-ngo-kinh-doanh-via-he-o-to-dung-o-sat-pho-gia-au-tu-pr45436442,Siêu phẩm Nguyên Hồng - 66m2 MT 5.5m - Mặt ngõ kinh doanh vỉa hè ô tô dừng đỗ sát phố - Giá đầu tư,"Đường Nguyên Hồng, Phường Láng Hạ, Quận Đống Đa, Hà Nội | (Phường Láng, Hà Nội mới)","Đường Nguyên Hồng, Phường Láng Hạ, Quận Đống Đa, Hà Nội","(Phường Láng, Hà Nội mới)","29,5 tỷ","~446,97 triệu/m²",4 phòng,Đống Đa,66 m²,"5,5 m",10 m,,,4 tầng,,Sổ đỏ/ Sổ hồng,12/06/2026,27/06/2026,Tin thường,45436442,21.0162695662308,105.81024142794
https://batdongsan.com.vn/ban-nha-rieng-pho-lang-ha-phuong-o-cho-dua-3/ban-ba-inh-60m-phan-lo-to-via-he-8-tang-thang-may-35-ty-pr45895786,"Bán nhà Láng Hạ, Ba Đình 60m² phân lô ô tô vỉa hè 8 tầng thang máy 35 tỷ","25 , Phố Láng Hạ, Phường Ô Chợ Dừa, Quận Đống Đa, Hà Nội | (Phường Ô Chợ Dừa, Hà Nội mới)","25 , Phố Láng Hạ, Phường Ô Chợ Dừa, Quận Đống Đa, Hà Nội","(Phường Ô Chợ Dừa, Hà Nội mới)",35 tỷ,"~583,33 triệu/m²",,Đống Đa,60 m²,5 m,8 m,,,8 tầng,,Sổ đỏ/ Sổ hồng,12/06/2026,27/06/2026,Tin thường,45895786,21.0185346847975,105.816674226697
https://batdongsan.com.vn/ban-nha-rieng-duong-dang-van-ngu-phuong-phuong-lien-3/ban-ang-ong-a-sieu-ep-64m2-7-tang-thang-may-o-to-35-ty-pr45895567,"Bán nhà Đặng Văn Ngữ, Đống Đa siêu đẹp 64m2 7 tầng thang máy ô tô 35 tỷ","Đường Đặng Văn Ngữ, Phường Phương Liên, Quận Đống Đa, Hà Nội | (Phường Văn Miếu-quốc Tử Giám, Hà Nội mới)","Đường Đặng Văn Ngữ, Phường Phương Liên, Quận Đống Đa, Hà Nội","(Phường Văn Miếu-quốc Tử Giám, Hà Nội mới)",35 tỷ,"~546,88 triệu/m²",,Đống Đa,64 m²,5 m,6 m,,,7 tầng,,Sổ đỏ/ Sổ hồng,12/06/2026,27/06/2026,Tin thường,45895567,21.012500104008,105.832305533718
https://batdongsan.com.vn/ban-nha-rieng-duong-tam-trinh-phuong-yen-so-8/ban-ngo-254-hoang-mai-ha-noi-ngo-o-to-4-tang-gan-gamuda-vanh-ai-3-pr45277932,"Bán nhà ngõ 254 Tam Trinh, Hoàng Mai, Hà Nội - Ngõ ô tô - 4 tầng - Gần Gamuda, Vành đai 3","số 1/23 ngõ 254, Đường Tam Trinh, Phường Yên Sở, Quận Hoàng Mai, Hà Nội | (Phường Hoàng Mai, Hà Nội mới)","số 1/23 ngõ 254, Đường Tam Trinh, Phường Yên Sở, Quận Hoàng Mai, Hà Nội","(Phường Hoàng Mai, Hà Nội mới)","7,05 tỷ","~211,08 triệu/m²",3 phòng,Hoàng Mai,"33,4 m²","3,5 m","3,5 m",Bắc,Tây - Nam,4 tầng,,Sổ đỏ/ Sổ hồng.,11/06/2026,26/06/2026,Tin thường,45277932,20.9732113379482,105.866513454854
https://batdongsan.com.vn/ban-nha-rieng-duong-le-van-luong-phuong-nhan-chinh-5/building-so-71-ngo-21-dong-tien-cao-san-ngang-12-4m-9-tang-ham-phap-ly-u-ep-pr45810885,"Building số 71 ngõ 21 Lê Văn Lương, dòng tiền cao sẵn, ngang 12.4m - 9 tầng (hầm), pháp lý đủ đẹp","Số 71 ngõ 21, Đường Lê Văn Lương, Phường Nhân Chính, Quận Thanh Xuân, Hà Nội | (Phường Thanh Xuân, Hà Nội mới)","Số 71 ngõ 21, Đường Lê Văn Lương, Phường Nhân Chính, Quận Thanh Xuân, Hà Nội","(Phường Thanh Xuân, Hà Nội mới)","78,9 tỷ","~657,5 triệu/m²",9 phòng,Thanh Xuân,120 m²,"12,4 m",8 m,Tây - Bắc,Tây - Bắc,9 tầng,,Sổ đỏ/ Sổ hồng,11/06/2026,26/06/2026,Tin thường,45810885,21.0038763585981,105.802713320214
https://batdongsan.com.vn/ban-dat-xa-lien-ha-2/ban-at-tai-lo-thu-lam-5-ty-82m2-uy-tin-chi-voi-pr45896814,"Bán đất tại Hà Lỗ, Thư Lâm, 5 tỷ, 81m2, uy tín chỉ với","Hà lỗ, Xã Liên Hà, Huyện Đông Anh, Hà Nội | (Xã Thư Lâm, Hà Nội mới)","Hà lỗ, Xã Liên Hà, Huyện Đông Anh, Hà Nội","(Xã Thư Lâm, Hà Nội mới)",5 tỷ,"~60,98 triệu/m²",,Đông Anh,82 m²,"4,3 m",,,,,,Sổ đỏ/ Sổ hồng,11/06/2026,26/06/2026,Tin thường,45896814,21.14443701376,105.897686155119
https://batdongsan.com.vn/ban-nha-rieng-duong-xuan-la-phuong-xuan-la-6/so-42-ngo-28-rong-nhu-mat-pho-toa-vp-hien-ai-hoan-cong-pccc-chuan-pr45811131,"Số 42 ngõ 28 Xuân La rộng như mặt phố. Tòa VP hiện đại, hoàn công, PCCC chuẩn","Số 42 ngõ 28, Đường Xuân La, Phường Xuân La, Quận Tây Hồ, Hà Nội | (Phường Tây Hồ, Hà Nội mới)","Số 42 ngõ 28, Đường Xuân La, Phường Xuân La, Quận Tây Hồ, Hà Nội","(Phường Tây Hồ, Hà Nội mới)",165 tỷ,~660 triệu/m²,9 phòng,Tây Hồ,250 m²,"7,75 m",20 m,Tây,Tây,9 tầng,,Sổ đỏ/ Sổ hồng,11/06/2026,26/06/2026,Tin thường,45811131,21.0648552573192,105.806104661018
https://batdongsan.com.vn/ban-nha-rieng-duong-my-dinh-phuong-my-dinh-1-14/ban-gara-oto-45m2-x-7-tang-thang-may-mt-5-3m-gia-13-9-ty-ctl-pr45122758,Bán nhà Mỹ Đình gara ô tô. 45m2 x 7 tầng thang máy. MT: 5.3m. Giá 12.9 tỷ (CTL),"đường Mỹ Đình, Phường Mỹ Đình 1, Quận Nam Từ Liêm, Hà Nội | (Phường Từ Liêm, Hà Nội mới)","đường Mỹ Đình, Phường Mỹ Đình 1, Quận Nam Từ Liêm, Hà Nội","(Phường Từ Liêm, Hà Nội mới)","12,9 tỷ","~286,67 triệu/m²",4 phòng,Nam Từ Liêm,45 m²,"5,3 m",4 m,,,7 tầng,,Sổ đỏ/ Sổ hồng,05/06/2026,20/06/2026,Tin thường,45122758,21.0236486353314,105.77370613743
https://batdongsan.com.vn/ban-dat-xa-binh-yen-1/re-nhat-thi-truong-ha-bang-hoa-lac-3-5-ty-so-huu-100m2-full-tho-mt-9-8m-o-to-tranh-cach-cnc-2km-pr45789143,"Rẻ nhất thị trường Hạ Bằng Hòa Lạc, 3,5 tỷ sở hữu 100m2 full thổ, MT 9,8m, ô tô tránh. Cách CNC 2km","thôn Sen Trì, Xã Bình Yên, Huyện Thạch Thất, Hà Nội | (Xã Hạ Bằng, Hà Nội mới)","thôn Sen Trì, Xã Bình Yên, Huyện Thạch Thất, Hà Nội","(Xã Hạ Bằng, Hà Nội mới)",35 triệu/m²,"~3,5 tỷ",,Thạch Thất,100 m²,"9,8 m",6 m,Tây - Nam,,,,Sổ đỏ/ Sổ hồng,08/06/2026,23/06/2026,Tin thường,45789143,21.045725205821,105.546294003725
https://batdongsan.com.vn/ban-dat-xa-tan-tien-16/ban-at-ha-noi-chinh-chu-83-8m2-chi-hon-1-5-ty-uong-o-to-mt-gan-6m-pr45164041,"Bán đất Hà Nội chính chủ 83.8m² chỉ 1.5 tỷ, đường ô tô mặt tiền gần 6m","Xã Tân Tiến, Huyện Chương Mỹ, Hà Nội | (Xã Trần Phú, Hà Nội mới)","Xã Tân Tiến, Huyện Chương Mỹ, Hà Nội","(Xã Trần Phú, Hà Nội mới)","1,5 tỷ","~17,9 triệu/m²",,Chương Mỹ,"83,8 m²",,,,,,,Sổ đỏ/ Sổ hồng,05/06/2026,20/06/2026,Tin thường,45164041,20.8698048889884,105.604887928479
https://batdongsan.com.vn/ban-nha-rieng-phuong-giang-vo/sieu-hiem-chdv-ba-inh-8-tang-thang-may-24p-kk-dong-tien-110tr-thang-xay-moi-u-pccc-pr45800169,Siêu hiếm - CHDV Ba Đình - 8 tầng thang máy - 24p kk - dòng tiền 110tr/tháng - xây mới - đủ PCCC,"Phường Giảng Võ, Quận Ba Đình, Hà Nội | (Phường Giảng Võ, Hà Nội mới)","Phường Giảng Võ, Quận Ba Đình, Hà Nội","(Phường Giảng Võ, Hà Nội mới)","17,2 tỷ","~268,75 triệu/m²",24 phòng,Ba Đình,64 m²,,,,,8 tầng,,Sổ đỏ/ Sổ hồng,11/06/2026,26/06/2026,Tin thường,45800169,21.02661263147,105.817542243986
https://batdongsan.com.vn/ban-dat-xa-tan-minh-4/chi-1-5x-ti-so-huu-ngay-89-5m-full-tho-cu-lo-goc-2-mat-duong-tai-son-doai-soc-son-ha-noi-pr44902777,"90m², full thổ cư, lô góc 2 mặt tiền, đường ô tô trải nhựa tại xã Sóc Sơn, Hà Nội, giá siêu rẻ","Xã Tân Minh, Huyện Sóc Sơn, Hà Nội | (Xã Sóc Sơn, Hà Nội mới)","Xã Tân Minh, Huyện Sóc Sơn, Hà Nội","(Xã Sóc Sơn, Hà Nội mới)","1,55 tỷ","~17,22 triệu/m²",,Sóc Sơn,90 m²,"3,5 m",,,,,,Sổ đỏ/ Sổ hồng.,28/05/2026,27/06/2026,Tin thường,44902777,21.2689006234619,105.876481060628
https://batdongsan.com.vn/ban-nha-rieng-duong-cau-giay-phuong-quan-hoa-7/kich-oc-toa-can-ho-pho-95m2-x-7-tang-mt9-5m-lo-goc-oto-tranh-dong-tien-130-tr-thang-pr45436868,"Máy in tiền! Toà căn hộ Cầu Giấy, 88.2/95m2x7 tầng, MT 9.5m, lô góc, ôtô tránh, dòng tiền 130 tr/th","Đường Cầu Giấy, Phường Quan Hoa, Quận Cầu Giấy, Hà Nội | (Phường Nghĩa Đô, Hà Nội mới)","Đường Cầu Giấy, Phường Quan Hoa, Quận Cầu Giấy, Hà Nội","(Phường Nghĩa Đô, Hà Nội mới)","37,8 tỷ","~428,57 triệu/m²",21 phòng,Cầu Giấy,"88,2 m²","9,5 m",5 m,,,7 tầng,,Sổ đỏ/ Sổ hồng,11/06/2026,26/06/2026,Tin thường,45436868,21.0320865692517,105.799558562746
https://batdongsan.com.vn/ban-dat-duong-dai-lo-thang-long-xa-tien-xuan-23/ban-at-yen-canh-xanh-villas-cach-hqg-ha-noi-300m-200m-ra-ga-metro5-pr45741583,"Bán đất Yên Xuân cạnh Xanh Villas cách ĐHQG Hà Nội 300m, 200m ra ga Metro 5","Đường Đại lộ Thăng Long, Xã Tiến Xuân, Huyện Thạch Thất, Hà Nội | (Xã Yên Xuân, Hà Nội mới)","Đường Đại lộ Thăng Long, Xã Tiến Xuân, Huyện Thạch Thất, Hà Nội","(Xã Yên Xuân, Hà Nội mới)","3,5 tỷ","~46,05 triệu/m²",,Thạch Thất,76 m²,7 m,12 m,,,,,Sổ đỏ/ Sổ hồng,07/06/2026,22/06/2026,Tin thường,45741583,20.9899014189838,105.520449338964
https://batdongsan.com.vn/ban-nha-rieng-duong-doi-can-phuong-ngoc-ha-2/tin-chuan-moi-oi-ngay-sat-ho-am-tron-10m-ra-pho-o-to-tranh-dtsd-40m2-thuong-luong-sau-pr45657697,"Tin chuẩn! Nhà mới Đội Cấn ngay sát hồ Đầm Tròn, 10m ra phố ô tô tránh, DTSD 40m2, thương lượng sâu","Đường Đội Cấn, Phường Ngọc Hà, Quận Ba Đình, Hà Nội | (Phường Ngọc Hà, Hà Nội mới)","Đường Đội Cấn, Phường Ngọc Hà, Quận Ba Đình, Hà Nội","(Phường Ngọc Hà, Hà Nội mới)","10,8 tỷ","~313,04 triệu/m²",5 phòng,Ba Đình,"34,5 m²",,,,,5 tầng,,Sổ đỏ/ Sổ hồng,11/06/2026,26/06/2026,Tin thường,45657697,21.0348320901977,105.82314362217
