Link,Tiêu đề,Địa chỉ,Địa chỉ 1,Địa chỉ 2,Mức giá,Giá/m²,Số phòng ngủ,Huyện,Diện tích,Mặt tiền,Đường vào,Hướng nhà,Hướng ban công,Số tầng,Số toilet,Pháp lý,Ngày đăng,Ngày hết hạn,Loại tin,Mã tin,Latitude,Longitude
https://batdongsan.com.vn/ban-dat-duong-an-duong-vuong-phuong-dong-ngac-718/ban-phu-thuong-sau-qh-ra-mat-pho-82m2-chi-13-9-ty-pr45112454,"Bán đất An Dương Vương, gần Phú Thượng, sau QH ra mặt phố 80,7m2 chỉ 13,9 tỷ","Đường An Dương Vương, Phường Đông Ngạc, Quận Bắc Từ Liêm, Hà Nội | (Phường Phú Thượng, Hà Nội mới)","Đường An Dương Vương, Phường Đông Ngạc, Quận Bắc Từ Liêm, Hà Nội","(Phường Phú Thượng, Hà Nội mới)","13,9 tỷ","~172,24 triệu/m²",,Bắc Từ Liêm,"80,7 m²",4 m,"3,2 m",,,,,Sổ đỏ/ Sổ hồng,06/06/2026,21/06/2026,Tin thường,45112454,21.0902842677499,105.791490716777
https://batdongsan.com.vn/ban-dat-duong-dt-87-xa-van-hoa-1-18/chinh-chu-can-ban-lo-nghi-tai-chan-nui-vuon-quoc-gia-ba-vi-dien-tich-2743-m2-tho-cu-150m2-pr43329583,"Đất Ba Vì, DT 2554m2 thổ cư 400m2, giá 14,5 tỷ tại chân núi Ba Vì Yên Bài mới HN","Đường ĐT 87, Xã Vân Hòa, Huyện Ba Vì, Hà Nội | (Xã Yên Bài, Hà Nội mới)","Đường ĐT 87, Xã Vân Hòa, Huyện Ba Vì, Hà Nội","(Xã Yên Bài, Hà Nội mới)","14,5 tỷ","~5,68 triệu/m²",,Ba Vì,2.554 m²,60 m,5 m,Đông - Nam,,,,Sổ đỏ/ Sổ hồng,06/06/2026,21/06/2026,Tin thường,43329583,21.0671065062775,105.401031822116
https://batdongsan.com.vn/ban-dat-duong-3-8-xa-mai-lam-10/42m-loc-ha-chi-3-2-ty-sat-ga-vinspeed-vin-co-loa-cau-tu-lien-co-hoi-au-tu-hiem-pr45868368,"42m Lộc Hà chỉ 3,2 tỷ sát ga Vinspeed, Vin Cổ Loa, Cầu Tứ Liên, cơ hội đầu tư hiếm","Đường 3, Xã Mai Lâm, Huyện Đông Anh, Hà Nội | (Xã Đông Anh, Hà Nội mới)","Đường 3, Xã Mai Lâm, Huyện Đông Anh, Hà Nội","(Xã Đông Anh, Hà Nội mới)","3,2 tỷ","~76,19 triệu/m²",,Đông Anh,42 m²,6 m,"2,2 m",,,,,Sổ đỏ/ Sổ hồng,06/06/2026,21/06/2026,Tin thường,45868368,21.0506278005152,105.845001308359
https://batdongsan.com.vn/ban-nha-rieng-pho-hao-nam-phuong-o-cho-dua-3/chinh-chu-ban-toa-ccmn-dt-70m2-mt-5-8m-8-tang-thang-may-2-thoang-thue-110-trieu-thang-pr45058363,"Chính chủ bán tòa CCMN Hào Nam DT 70m2,MT 5.8m, 8 tầng thang máy,2 thoáng, cho thuê 110 triệu/tháng","Phố Hào Nam, Phường Ô Chợ Dừa, Quận Đống Đa, Hà Nội | (Phường Ô Chợ Dừa, Hà Nội mới)","Phố Hào Nam, Phường Ô Chợ Dừa, Quận Đống Đa, Hà Nội","(Phường Ô Chợ Dừa, Hà Nội mới)","23,6 tỷ","~337,14 triệu/m²",17 phòng,Đống Đa,70 m²,"5,8 m",,,,8 tầng,,Sổ đỏ/ Sổ hồng,06/06/2026,21/06/2026,Tin thường,45058363,21.0253697114933,105.827402054084
https://batdongsan.com.vn/ban-dat-duong-tinh-lo-419-xa-thuong-lam-29/thon-trung-50m2-oto-tai-kd-2-05-ty-my-duc-lh-pr44995666,"Đất Thôn Trung, Thượng Lâm, 50m², ô tô tải KD, 1.85 tỷ Mỹ Đức. LH 0914 766 ***","Đường Tỉnh lộ 419, Xã Thượng Lâm, Huyện Mỹ Đức, Hà Nội | (Xã Phúc Sơn, Hà Nội mới)","Đường Tỉnh lộ 419, Xã Thượng Lâm, Huyện Mỹ Đức, Hà Nội","(Xã Phúc Sơn, Hà Nội mới)","1,85 tỷ",~37 triệu/m²,,Mỹ Đức,50 m²,"6,4 m",7 m,Tây,,,,Sổ đỏ/ Sổ hồng,06/06/2026,21/06/2026,Tin thường,44995666,20.7223235153068,105.7401612347
https://batdongsan.com.vn/ban-dat-xa-phung-chau/at-o-thi-chuong-my-61-5m-vuong-ep-gan-ai-hoc-thanh-khoan-cao-pr45783363,"Đất đô thị Chương Mỹ 61,5m² vuông đẹp gần đại học thanh khoản cao","Xã Phụng Châu, Huyện Chương Mỹ, Hà Nội | (Phường Chương Mỹ, Hà Nội mới)","Xã Phụng Châu, Huyện Chương Mỹ, Hà Nội","(Phường Chương Mỹ, Hà Nội mới)","3,85 tỷ","~62,6 triệu/m²",,Chương Mỹ,"61,5 m²","5,05 m",3 m,Tây - Bắc,,,,Sổ đỏ/ Sổ hồng,06/06/2026,21/06/2026,Tin thường,45783363,20.9442050960168,105.710030926359
https://batdongsan.com.vn/ban-dat-duong-to-huu-phuong-dai-mo-14/ban-at-uong-luong-the-vinh-nam-tu-liem-dien-tich-100m-o-vao-at-gia-19-99-ty-pr45541020,"Bán đất đường Tố Hữu, Lương Thế Vinh, Nam Từ Liêm diện tích 100m2, ô tô vào đất giá 18.99 tỷ","Đường Tố Hữu, Phường Đại Mỗ, Quận Nam Từ Liêm, Hà Nội | (Phường Đại Mỗ, Hà Nội mới)","Đường Tố Hữu, Phường Đại Mỗ, Quận Nam Từ Liêm, Hà Nội","(Phường Đại Mỗ, Hà Nội mới)","18,99 tỷ","~189,9 triệu/m²",,Nam Từ Liêm,100 m²,,"4,5 m",,,,,Sổ đỏ,06/06/2026,21/06/2026,Tin thường,45541020,20.9842990870571,105.773574672942
https://batdongsan.com.vn/ban-dat-xa-van-noi/ban-at-ep-ngo-4m-oto-vao-tai-chinh-3-5-ty-pr45867930,"Bán đất đẹp Vân Nội, ngõ 4m ô tô vào, tài chính 3,5 tỷ","Xã Vân Nội, Huyện Đông Anh, Hà Nội | (Xã Phúc Thịnh, Hà Nội mới)","Xã Vân Nội, Huyện Đông Anh, Hà Nội","(Xã Phúc Thịnh, Hà Nội mới)","3,5 tỷ","~83,33 triệu/m²",,Đông Anh,42 m²,4 m,4 m,Đông - Nam,,,,Sổ đỏ/ Sổ hồng,06/06/2026,21/06/2026,Tin thường,45867930,21.1573598578209,105.815643277019
https://batdongsan.com.vn/ban-dat-duong-an-trai-xa-van-canh-1-21/ban-58m2-dich-vu-huong-nam-gan-cong-vien-pr44659727,"Bán 46m² đất dịch vụ Vân Canh, khu 25ha giá 9.1 tỷ","Đường An Trai, Xã Vân Canh, Huyện Hoài Đức, Hà Nội | (Xã Sơn Đồng, Hà Nội mới)","Đường An Trai, Xã Vân Canh, Huyện Hoài Đức, Hà Nội","(Xã Sơn Đồng, Hà Nội mới)",195 triệu/m²,"~8,97 tỷ",,Hoài Đức,46 m²,"3,8 m",11 m,Bắc,,,,Sổ đỏ/ Sổ hồng,06/06/2026,21/06/2026,Tin thường,44659727,21.0330834199193,105.735165995236
https://batdongsan.com.vn/ban-nha-rieng-duong-tran-quang-dieu-phuong-o-cho-dua-3/sieu-pham-43m2-6-tang-thang-may-lo-goc-kinh-doanh-sam-uat-to-sat-pho-hiem-pr45506231,Siêu phẩm Trần Quang Diệu - 43m2 6 tầng thang máy lô góc - Kinh doanh sầm uất - Ô tô sát phố - Hiếm,"Đường Trần Quang Diệu, Phường Ô Chợ Dừa, Quận Đống Đa, Hà Nội | (Phường Đống Đa, Hà Nội mới)","Đường Trần Quang Diệu, Phường Ô Chợ Dừa, Quận Đống Đa, Hà Nội","(Phường Đống Đa, Hà Nội mới)",28 tỷ,"~651,16 triệu/m²",6 phòng,Đống Đa,43 m²,,,,,6 tầng,,Sổ đỏ/ Sổ hồng,06/06/2026,21/06/2026,Tin thường,45506231,21.0159010269623,105.824539326732
https://batdongsan.com.vn/ban-dat-duong-an-trai-xa-van-canh-1-21/ban-gap-78m2-at-dich-vu-khu-25ha-gia-cuc-tot-pr45297617,Bán gấp 78m2 đất dịch vụ Vân Canh khu 25ha giá cực tốt,"Đường An Trai, Xã Vân Canh, Huyện Hoài Đức, Hà Nội | (Xã Sơn Đồng, Hà Nội mới)","Đường An Trai, Xã Vân Canh, Huyện Hoài Đức, Hà Nội","(Xã Sơn Đồng, Hà Nội mới)",182 triệu/m²,"~14,2 tỷ",,Hoài Đức,78 m²,"5,2 m",11 m,Bắc,,,,Sổ đỏ/ Sổ hồng,06/06/2026,21/06/2026,Tin thường,45297617,21.0329945997779,105.735496436497
https://batdongsan.com.vn/ban-dat-duong-vanh-dai-3-5-xa-van-canh-1-21/ban-54m2-dich-vu-2-mat-thoang-rong-13m-gia-cuc-mem-pr44659533,"Bán 53.7m2 đất dịch vụ Vân Canh, 2 mặt thoáng đường rộng 13m giá cực mềm","Đường Vành Đai 3.5, Xã Vân Canh, Huyện Hoài Đức, Hà Nội | (Xã Sơn Đồng, Hà Nội mới)","Đường Vành Đai 3.5, Xã Vân Canh, Huyện Hoài Đức, Hà Nội","(Xã Sơn Đồng, Hà Nội mới)",188 triệu/m²,"~10,1 tỷ",,Hoài Đức,"53,7 m²","4,28 m",13 m,Bắc,,,,Sổ đỏ/ Sổ hồng,06/06/2026,21/06/2026,Tin thường,44659533,21.0333841079513,105.73216315849
https://batdongsan.com.vn/ban-dat-xa-lai-yen/ban-cat-lo-76m2-at-dich-vu-2-mat-thoang-pr45577559,Bán cắt lỗ 76m2 đất dịch vụ Lại Yên 2 mặt thoáng,"Xã Lại Yên, Huyện Hoài Đức, Hà Nội | (Xã Sơn Đồng, Hà Nội mới)","Xã Lại Yên, Huyện Hoài Đức, Hà Nội","(Xã Sơn Đồng, Hà Nội mới)",119 triệu/m²,"~9,04 tỷ",,Hoài Đức,76 m²,5 m,9 m,Đông - Bắc,,,,Sổ đỏ/ Sổ hồng,06/06/2026,21/06/2026,Tin thường,45577559,21.0281588380897,105.711156318661
https://batdongsan.com.vn/ban-nha-rieng-duong-nguyen-hong-phuong-lang-ha-3/cuc-hiem-ban-59m2-7-tang-mt-5-5-thang-may-kinh-doanh-sam-uat-vi-tri-dac-dia-pr43604652,Cực hiếm! Bán nhà Nguyên Hồng - 59m2 7 tầng MT 5.5m thang máy - Kinh doanh sầm uất - vị trí đắc địa,"Đường Nguyên Hồng, Phường Láng Hạ, Quận Đống Đa, Hà Nội | (Phường Láng, Hà Nội mới)","Đường Nguyên Hồng, Phường Láng Hạ, Quận Đống Đa, Hà Nội","(Phường Láng, Hà Nội mới)","31,8 tỷ","~538,98 triệu/m²",5 phòng,Đống Đa,59 m²,"5,5 m",,,,7 tầng,,Sổ đỏ/ Sổ hồng,06/06/2026,21/06/2026,Tin thường,43604652,21.0156926192172,105.809827790234
https://batdongsan.com.vn/ban-nha-rieng-pho-hoang-cau-phuong-o-cho-dua-3/sieu-pham-70m2-7-tang-thang-may-to-dung-dan-tri-cao-sat-ho-hiem-pr45444145,Siêu phẩm Hoàng Cầu - 70m2 7 tầng thang máy - Ô tô dừng đỗ - Dân trí cao sát hồ Hoàng Cầu - Hiếm!,"Phố Hoàng Cầu, Phường Ô Chợ Dừa, Quận Đống Đa, Hà Nội | (Phường Ô Chợ Dừa, Hà Nội mới)","Phố Hoàng Cầu, Phường Ô Chợ Dừa, Quận Đống Đa, Hà Nội","(Phường Ô Chợ Dừa, Hà Nội mới)","28,3 tỷ","~404,29 triệu/m²",7 phòng,Đống Đa,70 m²,,8 m,,,7 tầng,,Sổ đỏ/ Sổ hồng,06/06/2026,21/06/2026,Tin thường,45444145,21.016753455966,105.822662715822
https://batdongsan.com.vn/ban-nha-rieng-duong-doi-can-phuong-lieu-giai-2/ban-279-ba-dinh-85m2-mt-6-4m-o-to-xay-toa-vp-hay-apartment-cuc-dep-gia-dau-tu-pr44038483,Bán nhà 279 Đội Cấn Ba Đình - 85m2 MT 6.4m - ô tô - Xây tòa VP hay apartment cực đẹp - Giá đầu tư,"ngõ 279, Đường Đội Cấn, Phường Liễu Giai, Quận Ba Đình, Hà Nội | (Phường Ngọc Hà, Hà Nội mới)","ngõ 279, Đường Đội Cấn, Phường Liễu Giai, Quận Ba Đình, Hà Nội","(Phường Ngọc Hà, Hà Nội mới)","18,5 tỷ","~217,65 triệu/m²",5 phòng,Ba Đình,85 m²,"6,4 m",7 m,,,5 tầng,,Sổ đỏ/ Sổ hồng,06/06/2026,21/06/2026,Tin thường,44038483,21.0361539228536,105.816741230037
https://batdongsan.com.vn/ban-nha-rieng-pho-bach-mai-phuong-bach-mai-4/ban-toa-can-ho-dich-vu-cao-cap-dong-tien-50tr-thang-chao-gia-15-2-ty-co-tl-pr45378238,Bán tòa căn hộ dịch vụ cao cấp phố Bạch Mai - dòng tiền 50 triệu/tháng - chào giá 15 tỷ có TL,"Phố Bạch Mai, Phường Bạch Mai, Quận Hai Bà Trưng, Hà Nội | (Phường Bạch Mai, Hà Nội mới)","Phố Bạch Mai, Phường Bạch Mai, Quận Hai Bà Trưng, Hà Nội","(Phường Bạch Mai, Hà Nội mới)",15 tỷ,~300 triệu/m²,12 phòng,Hai Bà Trưng,50 m²,9 m,,,,5 tầng,,Sổ đỏ/ Sổ hồng,06/06/2026,21/06/2026,Tin thường,45378238,20.9977071925623,105.850419291171
https://batdongsan.com.vn/ban-dat-duong-3-8-xa-mai-lam-10/at-du-noi-74-1m-mat-tien-8-1m-view-nha-vh-o-to-tranh-giu-tien-inh-cao-so-o-ss-giao-dich-pr45454872,"Đất Du Nội 74,1m2, mặt tiền 8,1m, view nhà VH ô tô tránh giữ tiền đỉnh cao, sổ đỏ SS giao dịch","Du Nội, Đường 3, Xã Mai Lâm, Huyện Đông Anh, Hà Nội | (Xã Đông Anh, Hà Nội mới)","Du Nội, Đường 3, Xã Mai Lâm, Huyện Đông Anh, Hà Nội","(Xã Đông Anh, Hà Nội mới)","9,2 tỷ","~124,16 triệu/m²",,Đông Anh,"74,1 m²","8,1 m",7 m,,,,,Sổ đỏ/ Sổ hồng,06/06/2026,21/06/2026,Tin thường,45454872,21.0510786403823,105.844644187459
https://batdongsan.com.vn/ban-nha-rieng-pho-ton-duc-thang-phuong-van-mieu-quoc-tu-giam-3/soc-1-ty-ngay-nga-5-xa-an-5-tang-xay-moi-cuc-thoang-ngo-thong-gan-ho-san-e-xe-rieng-pr45685037,"Xem ngay! Tôn Đức Thắng, chỉ 7.6tỷ có nhà 30,1m2 5 tầng xây mới, mặt tiền rộng, thêm 20m sân riêng","Phố Tôn Đức Thắng, Phường Văn Miếu - Quốc Tử Giám, Quận Đống Đa, Hà Nội | (Phường Văn Miếu-quốc Tử Giám, Hà Nội mới)","Phố Tôn Đức Thắng, Phường Văn Miếu - Quốc Tử Giám, Quận Đống Đa, Hà Nội","(Phường Văn Miếu-quốc Tử Giám, Hà Nội mới)","7,6 tỷ","~252,49 triệu/m²",3 phòng,Đống Đa,"30,1 m²",,,,,5 tầng,,Sổ đỏ/ Sổ hồng,06/06/2026,21/06/2026,Tin thường,45685037,21.0265395366573,105.834044043826
https://batdongsan.com.vn/ban-dat-thi-tran-phuc-tho-2/tuyet-chung-at-o-o-trung-tam-ban-103m-at-gia-chi-41-trieu-m-pr45867610,Tuyệt chủng! Đất ở đô thị trung tâm Phúc Thọ. Bán 103m² đất Thị Trấn Phúc Thọ giá chỉ 41 triệu/m²,"Thị trấn Phúc Thọ, Huyện Phúc Thọ, Hà Nội | (Xã Phúc Thọ, Hà Nội mới)","Thị trấn Phúc Thọ, Huyện Phúc Thọ, Hà Nội","(Xã Phúc Thọ, Hà Nội mới)",41 triệu/m²,"~4,22 tỷ",,Phúc Thọ,103 m²,"5,9 m",4 m,Tây - Bắc,,,,Sổ đỏ/ Sổ hồng,06/06/2026,21/06/2026,Tin thường,45867610,21.1071812748523,105.540341583946
https://batdongsan.com.vn/ban-nha-rieng-duong-me-tri-thuong-phuong-me-tri-14/giam-chao-1-ty-ban-gap-6-tang-thang-may-kinh-doanh-o-to-dung-o-ngay-em-pr45867597,Giảm chào 1 tỷ! Bán gấp nhà Mễ Trì - 6 tầng thang máy - kinh doanh ô tô dừng đỗ ngày đêm,"Đường Mễ Trì Thượng, Phường Mễ Trì, Quận Nam Từ Liêm, Hà Nội | (Phường Từ Liêm, Hà Nội mới)","Đường Mễ Trì Thượng, Phường Mễ Trì, Quận Nam Từ Liêm, Hà Nội","(Phường Từ Liêm, Hà Nội mới)","10,5 tỷ",~300 triệu/m²,6 phòng,Nam Từ Liêm,35 m²,5 m,4 m,,,6 tầng,,Sổ đỏ/ Sổ hồng,06/06/2026,21/06/2026,Tin thường,45867597,21.0060839630603,105.778047849755
https://batdongsan.com.vn/ban-dat-xa-thuy-xuan-tien/83m-mat-hon-5m-linh-ngay-gan-khu-cn-phu-son-chi-2-x-ty-pr45722489,83m2 - mặt tiền hơn 5m - Xuân Linh - ngay gần khu CN Phú Sơn - chỉ 2.2 tỷ,"thôn Xuân Linh, Xã Thuỷ Xuân Tiên, Huyện Chương Mỹ, Hà Nội | (Xã Xuân Mai, Hà Nội mới)","thôn Xuân Linh, Xã Thuỷ Xuân Tiên, Huyện Chương Mỹ, Hà Nội","(Xã Xuân Mai, Hà Nội mới)","2,2 tỷ","~26,51 triệu/m²",,Chương Mỹ,83 m²,,,,,,,Sổ đỏ/sổ hồng,06/06/2026,21/06/2026,Tin thường,45722489,20.8804665152533,105.584628679736
https://batdongsan.com.vn/ban-dat-thi-tran-xuan-mai-1/58m-lo-goc-tan-binh-chi-2-x-ty-pr45740810,"57.4m² - lô góc - Tân Bình, Xuân Mai - chỉ 2.3 tỷ","Thị trấn Xuân Mai, Huyện Chương Mỹ, Hà Nội | (Xã Xuân Mai, Hà Nội mới)","Thị trấn Xuân Mai, Huyện Chương Mỹ, Hà Nội","(Xã Xuân Mai, Hà Nội mới)","2,3 tỷ","~40,07 triệu/m²",,Chương Mỹ,"57,4 m²","4,5 m",4 m,Đông,,,,Sổ đỏ/ Sổ hồng,06/06/2026,21/06/2026,Tin thường,45740810,20.8973838808149,105.574745710405
https://batdongsan.com.vn/ban-dat-xa-dong-hoi/hang-sieu-hiem-nam-lot-giua-3-du-an-lon-ang-gap-rut-hoan-thien-pr45867402,Hàng siêu hiếm. Nằm lọt giữa 3 dự án lớn đang gấp rút hoàn thiện,"Xã Đông Hội, Huyện Đông Anh, Hà Nội | (Xã Đông Anh, Hà Nội mới)","Xã Đông Hội, Huyện Đông Anh, Hà Nội","(Xã Đông Anh, Hà Nội mới)","6,49 tỷ","~117,01 triệu/m²",,Đông Anh,"55,5 m²","4,03 m",2 m,,,,,Sổ đỏ/ Sổ hồng,06/06/2026,21/06/2026,Tin thường,45867402,21.088417747395,105.868252431901
https://batdongsan.com.vn/ban-dat-xa-dong-son-4/ban-lo-91m2-duong-oto-tranh-nhau-tai-phu-nghia-gia-2-9-ti-pr45062266,"Chính chủ gửi bán đất 91m2 đường xe tránh nhau tại Đông Sơn - Phú Nghĩa giá 2,9 tỷ","Xã Đông Sơn, Huyện Chương Mỹ, Hà Nội | (Xã Phú Nghĩa, Hà Nội mới)","Xã Đông Sơn, Huyện Chương Mỹ, Hà Nội","(Xã Phú Nghĩa, Hà Nội mới)","2,9 tỷ","~31,87 triệu/m²",,Chương Mỹ,91 m²,"7,3 m",,,,,,Sổ đỏ,06/06/2026,21/06/2026,Tin thường,45062266,20.9317569963412,105.622660717216
https://batdongsan.com.vn/ban-dat-phuong-phu-thuong-1/ciputra-at-2-mat-tien-uong-17m-view-cong-vien-biet-thu-noble-ciputra-pr45781049,Gần Ciputra đất 2 mặt tiền đường 17m view công viên biệt thự Noble Ciputra,"Phường Phú Thượng, Quận Tây Hồ, Hà Nội | (Phường Phú Thượng, Hà Nội mới)","Phường Phú Thượng, Quận Tây Hồ, Hà Nội","(Phường Phú Thượng, Hà Nội mới)","32,5 tỷ","~328,28 triệu/m²",,Tây Hồ,99 m²,7 m,17 m,,,,,Sổ đỏ/ Sổ hồng,06/06/2026,21/06/2026,Tin thường,45781049,21.0808854428244,105.806457728612
https://batdongsan.com.vn/ban-dat-duong-van-noi-xa-van-noi-10/hang-nong-gia-re-uong-truoc-at-4m-o-to-tai-o-cua-gan-cho-tri-cach-uong-vo-nguyen-giap-300-pr45866525,Hàng nóng giá rẻ đường trước đất 4m ôtô tải đỗ cửa - Gần chợ Vân Trì cách đường Võ Nguyên Giáp 300m,"Đường Vân Nội, Xã Vân Nội, Huyện Đông Anh, Hà Nội | (Xã Phúc Thịnh, Hà Nội mới)","Đường Vân Nội, Xã Vân Nội, Huyện Đông Anh, Hà Nội","(Xã Phúc Thịnh, Hà Nội mới)","3,5 tỷ","~83,73 triệu/m²",,Đông Anh,"41,8 m²",4 m,4 m,,,,,Sổ đỏ/ Sổ hồng,06/06/2026,21/06/2026,Tin thường,45866525,21.1471026408781,105.814313921225
https://batdongsan.com.vn/ban-dat-duong-nguyen-lam-1-phuong-phuc-dong-9/manh-at-100m-mt-5-5m-phan-lo-oto-tranh-tai-ong-chi-19-9-ty-pr45715430,"Mảnh đất 100m² MT 5,5m phân lô ô tô tránh tại Nguyễn Lam Phúc Đồng - chỉ 19,9 tỷ","Đường Nguyễn Lam, Phường Phúc Đồng, Quận Long Biên, Hà Nội | (Phường Long Biên, Hà Nội mới)","Đường Nguyễn Lam, Phường Phúc Đồng, Quận Long Biên, Hà Nội","(Phường Long Biên, Hà Nội mới)","19,9 tỷ",~199 triệu/m²,,Long Biên,100 m²,"5,5 m",8 m,,,,,Sổ đỏ/ Sổ hồng,06/06/2026,21/06/2026,Tin thường,45715430,21.0401744654168,105.905570721813
https://batdongsan.com.vn/ban-dat-duong-mai-hien-xa-mai-lam-10/sieu-pham-view-ho-gan-vinhomes-yen-thuong-o-to-tranh-au-tu-giu-tien-cuc-tot-pr45832922,Siêu phẩm view hồ - gần Vinhomes Yên Thường - ô tô tránh đầu tư giữ tiền cực tốt,"Đường Mai Hiên, Xã Mai Lâm, Huyện Đông Anh, Hà Nội | (Xã Đông Anh, Hà Nội mới)","Đường Mai Hiên, Xã Mai Lâm, Huyện Đông Anh, Hà Nội","(Xã Đông Anh, Hà Nội mới)","8,4 tỷ",~140 triệu/m²,,Đông Anh,60 m²,4 m,6 m,Tây - Bắc,,,,Sổ đỏ/ Sổ hồng,01/06/2026,16/06/2026,Tin thường,45832922,21.0859559420855,105.888560563327
https://batdongsan.com.vn/ban-dat-phuong-phu-luong-3/ban-at-khu-au-gia-2-ha-noi-pr45291338,"Bán đất khu đấu giá Phú Lương 2, phường Phú Lương, Hà Nội","Phường Phú Lương, Quận Hà Đông, Hà Nội | (Phường Phú Lương, Hà Nội mới)","Phường Phú Lương, Quận Hà Đông, Hà Nội","(Phường Phú Lương, Hà Nội mới)","12,5 tỷ",~250 triệu/m²,,Hà Đông,50 m²,5 m,20 m,,,,,Sổ đỏ/ Sổ hồng,06/06/2026,21/06/2026,Tin thường,45291338,20.9407116137858,105.76912432466
https://batdongsan.com.vn/ban-dat-thi-tran-quang-minh/at-ep-to-9-tt-me-linh-hn-dt-66-1m2-100-at-tho-cu-mt-hau-4m-pr45604906,"Đất đẹp tổ 9 TT Quang Minh - Mê Linh - HN. DT: 66,1m² - 100% đất thổ cư MT = hậu: 4m","Thị trấn Quang Minh, Huyện Mê Linh, Hà Nội | (Xã Quang Minh, Hà Nội mới)","Thị trấn Quang Minh, Huyện Mê Linh, Hà Nội","(Xã Quang Minh, Hà Nội mới)",52 triệu/m²,"~3,44 tỷ",,Mê Linh,"66,1 m²",4 m,,Tây - Bắc,,,,Sổ đỏ/ Sổ hồng.,06/06/2026,21/06/2026,Tin thường,45604906,21.1813986701781,105.760793611407
https://batdongsan.com.vn/ban-dat-xa-van-canh-1/ban-lo-at-2-mat-tien-dt-60m-sat-cong-vien-thoang-mat-nam-trong-khu-at-dich-vu-25-2ha-canh-pr45865959,"Bán lô đất 2 mặt tiền DT 60m2 sát công viên thoáng mát nằm trong khu đất dịch vụ 25,2ha Vân Canh","Xã Vân Canh, Huyện Hoài Đức, Hà Nội | (Xã Sơn Đồng, Hà Nội mới)","Xã Vân Canh, Huyện Hoài Đức, Hà Nội","(Xã Sơn Đồng, Hà Nội mới)",192 triệu/m²,"~11,52 tỷ",,Hoài Đức,60 m²,"3,76 m",11 m,Đông,,,,Sổ đỏ/ Sổ hồng,06/06/2026,21/06/2026,Tin thường,45865959,21.0300715942346,105.732242307121
https://batdongsan.com.vn/ban-dat-duong-dang-vu-hy-phuong-thuong-thanh-1-9/ban-at-lo-goc-2-mat-tien-via-he-rong-khu-tai-inh-cu-90m2-gia-22-ty-pr45458208,"Bán đất lô góc 2 mặt tiền, vỉa hè rộng, khu tái định cư Thượng Thanh 90m2, giá 22 tỷ","Đường Đặng Vũ Hỷ, Phường Thượng Thanh, Quận Long Biên, Hà Nội | (Phường Việt Hưng, Hà Nội mới)","Đường Đặng Vũ Hỷ, Phường Thượng Thanh, Quận Long Biên, Hà Nội","(Phường Việt Hưng, Hà Nội mới)",22 tỷ,"~244,44 triệu/m²",,Long Biên,90 m²,"7,2 m",13 m,,,,,Sổ đỏ/ Sổ hồng,06/06/2026,21/06/2026,Tin thường,45458208,21.0728869613375,105.898178987336
https://batdongsan.com.vn/ban-dat-duong-dong-trang-xa-co-dong-16/chi-tu-2-ty-at-mat-uong-ong-trung-tam-kdt-ve-tinh-tp-hoa-lac-ha-noi-100m2-full-tho-cu-pr45865725,"Chỉ 2 tỷ đất mặt đường Đồng Trạng, trung tâm KDT vệ tinh TP Hòa Lạc, Hà Nội 100m² full thổ cư","Đường Đồng Trạng, Xã Cổ Đông, Thị xã Sơn Tây, Hà Nội | (Xã Đoài Phương, Hà Nội mới)","Đường Đồng Trạng, Xã Cổ Đông, Thị xã Sơn Tây, Hà Nội","(Xã Đoài Phương, Hà Nội mới)",2 tỷ,~20 triệu/m²,,Sơn Tây,100 m²,,12 m,,,,,Sổ đỏ/ Sổ hồng,06/06/2026,21/06/2026,Tin thường,45865725,21.042086616693,105.516292596951
https://batdongsan.com.vn/ban-dat-xa-thanh-binh-13/43m-o-to-o-cua-gia-chi-1ty2-pr45865711,43m2 Thanh Bình ô tô đỗ cửa giá chỉ 1tỷ2,"Xã Thanh Bình, Huyện Chương Mỹ, Hà Nội | (Xã Phú Nghĩa, Hà Nội mới)","Xã Thanh Bình, Huyện Chương Mỹ, Hà Nội","(Xã Phú Nghĩa, Hà Nội mới)","1,2 tỷ","~27,91 triệu/m²",,Chương Mỹ,43 m²,5 m,3 m,,,,,Sổ đỏ/ Sổ hồng,06/06/2026,21/06/2026,Tin thường,45865711,20.9016053606555,105.624646507482
https://batdongsan.com.vn/ban-nha-rieng-duong-mieu-dam-phuong-me-tri-14/giam-1-ty-ban-gap-40m-6-tang-thang-may-o-to-o-cua-gia-11-ty-pr45336452,"Giảm 1 tỷ, bán gấp nhà Mễ Trì 35m2, 6 tầng, thang máy, ô tô đỗ cửa - giá 11 tỷ","Đường Miếu Đầm, Phường Mễ Trì, Quận Nam Từ Liêm, Hà Nội | (Phường Từ Liêm, Hà Nội mới)","Đường Miếu Đầm, Phường Mễ Trì, Quận Nam Từ Liêm, Hà Nội","(Phường Từ Liêm, Hà Nội mới)",11 tỷ,"~314,29 triệu/m²",5 phòng,Nam Từ Liêm,35 m²,5 m,4 m,,,6 tầng,,Sổ đỏ/ Sổ hồng.,06/06/2026,21/06/2026,Tin thường,45336452,21.0052872781632,105.782720717564
https://batdongsan.com.vn/ban-nha-rieng-pho-vu-tong-phan-phuong-khuong-dinh-5/sieu-vi-tri-10m-ra-xay-moi-6-tang-thang-may-lung-lung-mat-tien-be-the-pr45534636,"Siêu vị trí Vũ Tông Phan, 10m ra phố, xây mới 6 tầng thang máy lừng lững, mặt tiền bề thế","Phố Vũ Tông Phan, Phường Khương Đình, Quận Thanh Xuân, Hà Nội | (Phường Khương Đình, Hà Nội mới)","Phố Vũ Tông Phan, Phường Khương Đình, Quận Thanh Xuân, Hà Nội","(Phường Khương Đình, Hà Nội mới)","9,8 tỷ","~306,25 triệu/m²",4 phòng,Thanh Xuân,32 m²,"4,55 m",,,,6 tầng,,Sổ đỏ/ Sổ hồng,06/06/2026,21/06/2026,Tin thường,45534636,20.9976221954901,105.817034315393
https://batdongsan.com.vn/ban-nha-rieng-pho-vu-tong-phan-phuong-khuong-dinh-5/ngo-o-to-thanh-xuan-42m2-5-tang-xay-moi-ngo-thong-kinh-doanh-thang-may-cho-pr45534780,Nhà ngõ ô tô Thanh Xuân 42m2 - 5 tầng xây mới - ngõ thông kinh doanh - thang máy chờ - 0965 118 ***,"Phố Vũ Tông Phan, Phường Khương Đình, Quận Thanh Xuân, Hà Nội | (Phường Khương Đình, Hà Nội mới)","Phố Vũ Tông Phan, Phường Khương Đình, Quận Thanh Xuân, Hà Nội","(Phường Khương Đình, Hà Nội mới)","11,5 tỷ","~273,81 triệu/m²",6 phòng,Thanh Xuân,42 m²,4 m,,,,5 tầng,,Sổ đỏ/ Sổ hồng,06/06/2026,21/06/2026,Tin thường,45534780,20.9975886366457,105.81705598873
https://batdongsan.com.vn/ban-nha-rieng-duong-doi-nhan-phuong-cong-vi-2/phan-lo-oi-ba-inh-59-3m-6-tang-moi-thang-may-o-to-o-cua-mat-tien-4-8m-gia-16-5-ty-pr45863210,"Nhà phân lô Đội Nhân, Ba Đình 59.3m² + 6 tầng mới, thang máy, ô tô đỗ cửa, MT 4.8m giá 16.5 tỷ","Đường Đội Nhân, Phường Cống Vị, Quận Ba Đình, Hà Nội | (Phường Ngọc Hà, Hà Nội mới)","Đường Đội Nhân, Phường Cống Vị, Quận Ba Đình, Hà Nội","(Phường Ngọc Hà, Hà Nội mới)","16,5 tỷ","~278,25 triệu/m²",3 phòng,Ba Đình,"59,3 m²","4,8 m",,,,6 tầng,,Sổ đỏ/ Sổ hồng,06/06/2026,21/06/2026,Tin thường,45863210,21.0413437800941,105.811370952925
https://batdongsan.com.vn/ban-dat-xa-minh-quang/lo-goc-ep-cach-2-uong-tl-vai-tram-met-the-at-cao-view-nui-gan-truong-cho-ub-xa-pr45776211,"Lô góc đẹp Minh Quang cách 2 đường TL vài trăm mét, thế đất cao, view núi, gần trường, chợ, UB xã","Thôn Vip, Xã Minh Quang, Huyện Ba Vì, Hà Nội | (Xã Ba Vì, Hà Nội mới)","Thôn Vip, Xã Minh Quang, Huyện Ba Vì, Hà Nội","(Xã Ba Vì, Hà Nội mới)","1,75 tỷ","~3,82 triệu/m²",,Ba Vì,"457,5 m²",,,,,,,Sổ đỏ/ Sổ hồng.,06/06/2026,21/06/2026,Tin thường,45776211,21.06749813972,105.325850663047
